TURN,UTTERANCE,DA,EMOTION
Ses02M_impro05_F006,Uh- it didn't make it into the second plane so it looks like there - they don't actually know what happened to it.,s,neu
Ses02M_impro05_M005,What? What? How does that happen?,q,xxx
Ses02M_impro05_F007,"Um, well, sometimes there is just difficulties with loading on to the plane. Uh- There can be a theft or uh- some sort of you know mishap with a cart or something.",ans,neu
Ses02M_impro05_M006,I really - I really need that bag.,s,fru
Ses02M_impro05_F008,"I- I- I understand, but um.",ag,neu
Ses02M_impro05_M007,there are- I have important things in that bag. I've got,s,xxx
Ses02M_impro05_F009,Okay,ag,neu
Ses02M_impro05_M008,"I mean -- I've been away for a while and- and now I've- I've gifts for- for you know friends and family I mean, I got stuff in the there",s,fru
Ses02M_impro05_F010,Right.,b,neu
Ses02M_impro05_M009,It's worth a lot.,s,xxx
Ses02M_impro05_F011,"I understand that. Um- So I'm going to put down here that you looking for your baggage, but we actually can't, uh this bag is likely not going to show up so what we're going to do-",s,neu
Ses02M_impro05_M010,"Not going to show - well isn't like - wouldn't it just be at the airport, that, like, if it didn't get on the other plane",q,fru
Ses02M_impro05_M011,can they check there?,q,fru
Ses02M_impro05_F012,"Sometimes it gets stolen, sometimes it gets misplaced on another plane and",ans,neu
Ses02M_impro05_M012,on another-,b,xxx
Ses02M_impro05_F013,"they - they, it gets shipped to somewhere else and then it's stuck somewhere and then we have no way of tracking that.",s,neu
Ses02M_impro05_F014,So we'll- what we'll do,s,neu
Ses02M_impro05_M013,"But we have the tags on. I mean like it wouldn't you know, if it got stuck somewhere it's like well this is nobodies bag I mean maybe you know look on the tag and",o,ang
Ses02M_impro05_M014,see where it came from originally. I mean it seems like-,o,fru
Ses02M_impro05_F015,Right. Like I said sometimes a theft and things happen like that but we are willing to reim-reimburse you.,ag,neu
Ses02M_impro05_M015,Theft?,q,xxx
Ses02M_impro05_F016,"Um, so.",b,neu
Ses02M_impro05_M016,"Theft? Don't you know like all these people that are work - you keep like an eye on them, how can they get away with-",q,ang
Ses02M_impro05_F017,"We have very tight security but we -uh- there are times when we just can't uh make sure there aren't absolutely no human error, you know",ans,neu
Ses02M_impro05_F018,I'm sorry there is no guarantee on baggage.,ap,neu
Ses02M_impro05_M017,This is unbelievable. I've got,o,fru
Ses02M_impro05_M018,you don't realize the stuff that I've got in that - I really need to get the suitcase okay,s,ang
Ses02M_impro05_F019,"I understand, so-",ag,neu
Ses02M_impro05_M019,"so if it's back there or something, if there is something you can do",c,fru
Ses02M_impro05_M020,"I need you to tell me because I really need to get the bag, okay?",c,fru
Ses02M_impro05_F020,"all right, We've already checked back here for your baggage",s,neu
Ses02M_impro05_F021,and we will continue to look for it and because your paper-,s,neu
Ses02M_impro05_M021,You've already checked? Can you check again? [garbage],q,fru
Ses02M_impro05_F022,"I've already looked, thank you very much and because we've filled out paperwork if it shows up we will send it to you but otherwise what we can do is reimburse you for fifty dollar.",s,fru
Ses02M_impro05_M022,Fifty- fifty dollars? Come on you have got to be joking.,s,xxx
Ses02M_impro05_F023,"Well, it's- it's just sort of help with the fact uh that you lost some of your possessions and we rather do that than-",s,neu
Ses02M_impro05_M023,"Uh huh, yea, lost some of my possessions, yes, so if I lost maybe a shoe that was in the suitcase and like a carry-on",s,fru
Ses02M_impro05_M024,"that might be like fifty dollars okay, but this - I- [garbage] I had like thousands of dollars worth of stuff in that suitcase.",s,fru
Ses02M_impro05_F024,The airline can't afford to give you everything that is in that suitcase. and so-,s,neu
Ses02M_impro05_M025,The a- what? Talking about a core they can't afford it? I mean-,q,ang
Ses02M_impro05_F025,Well because lots of people get their baggage lost and we don't want to have false claims or anything like that so we have,ans,neu
Ses02M_impro05_F026,"we can give you fifty dollar to sort of make up for it, to compensate, and we can definitely let you know if it shows up but likely, more than likely-",s,neu
Ses02M_impro05_M026,I mean you're not helping me here. What do I have to do here? Do I need to sue the airline company is that what I should do,q,ang
Ses02M_impro05_M027,because this is ridiculous?,o,fru
Ses02M_impro05_F027,I'm sorry. I don't- I-,ap,xxx
Ses02M_impro05_F028,I don't believe you should sue the airline company but we do have a policy uh- in which we can reimburse you and that's all we can do and I'm sorry I've done everything I can-,s,fru
Ses02M_impro05_M028,All right. I'm sick- I'm sick of this all right. I'm sick of you and keep your fifty dollar.,o,fru
Ses02M_impro05_F029,There's other people waiting-,s,fru
Ses02M_impro05_F030,Fine.,ag,xxx
Ses02M_impro06_F001,"Oh my God. Oh my God, I'm so sorry.",ap,sur
Ses02M_impro06_M001,"yeah, I mean, you know, it was a -",s,sad
Ses02M_impro06_M003,"I mean at least she was home, she wasn't in the hospital anymore,",s,sad
Ses02M_impro06_F003,"Oh, man. I'm so sorry.",ap,sad
Ses02M_impro06_M004,"She was with- yeah  She was with Gary, and he said that she was just sitting there and went to sleep, closed her eyes, and that was it.",s,sad
Ses02M_impro06_F004,"It's going to be so rough, I'm sorry.",o,sad
Ses02M_impro06_F005,Yeah.,ag,sad
Ses02M_impro06_M007,"out to- out to dinner you know and do the troops to California, I mean.",s,sad
Ses02M_impro06_F006,Totally.,ag,sad
Ses02M_impro06_M008,"It's just that- I don't know, it's sort it's sort- of a weird thing you know",o,sad
Ses02M_impro06_F007,Yeah,b,sad
Ses02M_impro06_M009,"not being able to see anyone again, who knows where they really went, you know. I mean, I guess we can just hope that wherever they are now if it's anywhere that it's better I mean.",o,sad
Ses02M_impro06_F008,"Yes. Well, at least you have a lot of good memories.",ag,sad
Ses02M_impro06_M010,She was [garbage],s,sad
Ses02M_impro06_F009,"She really cared about you, you know.",o,sad
Ses02M_impro06_M011,"Yes, I mean she cared about all of us. She was great",o,sad
Ses02M_impro06_M012,so loving everybody you know.,o,sad
Ses02M_impro06_F010,And she was,s,sad
Ses02M_impro06_M013,"Gosh, I just hate I just hate to see her go.",o,sad
Ses02M_impro06_F011,Yeah.,b,sad
Ses02M_impro06_M014,We were all going take a trip to Europe you know.,s,sad
Ses02M_impro06_F012,Even if you still do she'll- she'll be there.,o,sad
Ses02M_impro06_M015,Yes.  [BREATHING] God.,ag,sad
Ses02M_impro06_F013,Are you going to be okay?,q,sad
Ses02M_impro06_M016,"I just -- I just don't get it, like there is just nothing you can do about it you know, it's like just out of your control and it",ans,sad
Ses02M_impro06_M017,"just makes it that much harder to deal 'cause as much as you want to, you know, make her better, see her not in any pain, it's like, just I don't know, just has a mind of its own.",o,sad
Ses02M_impro06_M018,Then she's gone.,s,sad
Ses02M_impro06_F014,"It's going to be okay, I promise.",o,sad
Ses02M_impro06_M019,"Well, you know I appreciate you coming over and talking to me, I mean it definitely helps",a,sad
Ses02M_impro06_F015,Sure,ag,sad
Ses02M_impro06_M020,to talk to somebody but,s,sad
Ses02M_impro06_F016,you shouldn't be alone,o,sad
Ses02M_impro06_M021,"It's just going to take a while, I think.",o,sad
Ses02M_impro06_F017,Yes.,ag,sad
Ses02M_impro06_M022,Ah.,b,sad
Ses02M_impro06_M023,Thank you.,g,sad
Ses02M_impro06_F018,Yes.,b,sad
Ses02M_impro07_M000,"[BREATHING] So, you know I've been hearing back from some colleges.",s,xxx
Ses02M_impro07_F000,"Oh, yeah? Have you gotten letters yet?",q,exc
Ses02M_impro07_M001,Yeah. And guess who accepted me?,q,xxx
Ses02M_impro07_F001,"Um, I don't know, where?",q,exc
Ses02M_impro07_M002,U.S.C..,ans,exc
Ses02M_impro07_F002,"Oh, U.S.C.? Oh my Gosh, that's awesome, that was your top choice, right?",q,sur
Ses02M_impro07_F003,"Oh my Gosh, that's so cool.",o,exc
Ses02M_impro07_M004,"God, I-I got this big packet you know, in the mail and it's like-",s,xxx
Ses02M_impro07_M005,"yes, this is [LAUGHTER], it says U.S.C., like registrar, I mean like, I got-I got some like little letters before you know, it's like oh rejection",s,xxx
Ses02M_impro07_F005,"Oh my Gosh, that's so cool.",o,exc
Ses02M_impro07_M006,"but big packet, big packet is nice",o,exc
Ses02M_impro07_F006,big packet is gotta be the real thing. yeah,ag,exc
Ses02M_impro07_M007,"So it's like, yes, rip it open and there it is big - oh, yes.",ag,exc
Ses02M_impro07_F008,That's so cool.,o,exc
Ses02M_impro07_M008,"Yeah. I know, I know.",ag,exc
Ses02M_impro07_M009,it was you know I wasn't too sure I mean you know it was kind of last minute for like the application,o,hap
Ses02M_impro07_M010,and everything like but,s,hap
Ses02M_impro07_F009,"Yeah, totally.",b,exc
Ses02M_impro07_M011,"it was good, yeah. I mean-",o,hap
Ses02M_impro07_M012,"I know, I know, yea. It'll be interesting you know, I've never -- I mean getting out of Vegas and everything but LA",o,xxx
Ses02M_impro07_M013,I'm looking forward to it.,o,exc
Ses02M_impro07_F011,So can we hang out?,q,exc
Ses02M_impro07_M014,"Hey, yes, you know that's - that's what I'm coming for.",ans,exc
Ses02M_impro07_F012,Yay.,ag,exc
Ses02M_impro07_M015,You're half the reason I'm going. [LAUGHTER],s,exc
Ses02M_impro07_F013,"Oh, yay. Thank you. [LAUGHTER].",a,exc
Ses02M_impro07_F014,No but that's an awesome school. That's so cool.,o,hap
Ses02M_impro07_M016,"I know ahh- yeah-, I'm definitely looking forward to it, and I mean they had a great football season last year",s,xxx
Ses02M_impro07_F015,"Oh, totally totally.",ag,hap
Ses02M_impro07_M017,"You know what I mean, I bet the home games, are just like nuts you know.",s,exc
Ses02M_impro07_F016,you get to like be a part of that.,s,hap
Ses02M_impro07_F017,"Like you get to be a part of that. Like the, like the- Like a cult.",s,hap
Ses02M_impro07_M018,What?,q,exc
Ses02M_impro07_M019,[LAUGHTER] I know. I mean part of-,ag,exc
Ses02M_impro07_F018,"[LAUGHTER] like a- like a- [LAUGHTER] No, but I mean like everywhere you go people know who you are.",o,hap
Ses02M_impro07_M020,Yeah. Right. A cult. I'm looking forward to being in the cult.,ag,exc
Ses02M_impro07_M021,"Right I know, like you, it won't hurt, I mean national champions last year, wow, you know",s,exc
Ses02M_impro07_M022,Maybe we'll do it again this year.,o,exc
Ses02M_impro07_F019,So you know what you are going to do there?,q,hap
Ses02M_impro07_M023,"What's that? ahh Well, you know I'm I'm thinking um I'm leaning towards like communications",s,hap
Ses02M_impro07_M024,"I-I don't know. Kind of a broad,",o,hap
Ses02M_impro07_F020,"Okay. They have a lot of good schools, right?",q,hap
Ses02M_impro07_M025,"yeah, I mean a lot-a lot  of good stuff oh, yeah, I mean it's- it's just a really good school; so really, whatever I pick I can't go wrong. I mean I'm just",ans,hap
Ses02M_impro07_M026,"I'm looking forward to getting there. I mean, God, the campus is cool, you know it's like all just very confined I mean just you know it's a college campus you know it's like",s,hap
Ses02M_impro07_F021,"Yes, it's intimate.",o,hap
Ses02M_impro07_M027,"It's college- oh my God it's college, [GARBAGE] so it's like crazy.",o,xxx
Ses02M_impro07_F022,I know. It's so cool.,ag,exc
Ses02M_impro07_M028,"Oh man. So, I don't know you know, we'll see - we'll see how it goes and, yeah, I'm looking forward to it",o,xxx
Ses02M_impro07_F023,"Fair for you, Wow, oh my Gosh.",o,exc
Ses02M_impro07_M029,I mean you got to - you got to show me the ropes 'cause I've never been there before so I mean you know your way around already and- [LAUGHTER],c,exc
Ses02M_impro07_F024,I will do the best I can.,o,hap
Ses02M_impro07_F025,"Well, there are all kinds of awesome secrets so you'll really enjoy it. It's really great. I'm so glad.",o,exc
Ses02M_impro07_M030,"Oh, alright.",ag,hap
Ses02M_impro07_M031,"I'm-I'm looking forward to that. [BREATHING] man, So yeah, I think I'm going to come out a little early so I mean I'll give you a call and we'll definitely-",s,exc
Ses02M_impro07_F026,Yay,b,exc
Ses02M_impro07_F027,"Okay. Yes, totally come visit",ag,exc
Ses02M_impro07_F028,"and we'll explore and you going to have such a good time, you're going to fit in so well, it's going to be awesome",o,hap
Ses02M_impro07_M032,"[LAUGHTER] Thanks, yes, thanks, yes That'll be cool.",ag,exc
Ses02M_impro07_F029,So Congratulations. That's awesome.,o,hap
Ses02M_impro08_M000,All right. Customer service this is Steve.,s,neu
Ses02M_impro08_F000,"Hi. Thank you so much, you're a real person, right, you're not like a recording?",q,exc
Ses02M_impro08_M001,"I'm a real person, yes.",ans,xxx
Ses02M_impro08_F001,"Okay. Before I get into it, um your menu or whatever like where you choose the different thing depending on the-",s,exc
Ses02M_impro08_F002,"it leads you around in circles, you can't, there is no way to like get to a real person if you don't already know how to get to there.",s,exc
Ses02M_impro08_M002,"Right. No, yes I know. It is-It is a little frustrating.",ag,neu
Ses02M_impro08_F003,"So is there any way to like bypass that because that is so, like I've been going around in circles",q,fru
Ses02M_impro08_F004,"like press nine, press zero, press back to the menu, like I can't get through to what I'm supposed to get through to.",s,fru
Ses02M_impro08_M004,"pretend like your on a rotary phone, goes straight through to a person.",s,neu
Ses02M_impro08_F005,"Okay. Oh, that would just make it so much better, 'cause I cannot handle it's just like oh, my God I can't sit here any longer and talk to this lady with this pleasant voice.",o,fru
Ses02M_impro08_M005,I know they don't tell you that kind of thing.,ag,neu
Ses02M_impro08_F006,"Sorry. Okay. Um-, yes",ap,neu
Ses02M_impro08_M006,Alright. Well you got me now.,ag,xxx
Ses02M_impro08_F007,"Thank you very much. Um  So I have a charge on my credit card that, um, isn't mine.",s,neu
Ses02M_impro08_F008,"Uh, I don't know where it came from and it's actually quite large, and I don't have the money for it so",s,neu
Ses02M_impro08_F009,it really freaks me out when I got my bill because it was like I don't -- I didn't spend this. This is not my charge.,s,fru
Ses02M_impro08_M007,"Yea. All right. Well, let me-let me look it up here for a second. Uh, so i think",s,neu
Ses02M_impro08_F010,"Okay, it was um- at the [GARBAGE] sorry, it was at a department store, I think it was Macy's or something",s,neu
Ses02M_impro08_M008,"Okay, Alright, yeah. I- I see it on here.",ag,neu
Ses02M_impro08_F011,"and it was like something like eight hundred dollars. I don't remember. It was just a lot and I have thing in front of me right now, but-",s,fru
Ses02M_impro08_M009,"All right. Well, you know that's, that's what we have all of our protection plans for and everything like that so I mean it's",s,neu
Ses02M_impro08_F012,Okay. So is there something I can do to get rid of it?,q,xxx
Ses02M_impro08_M010,it- it'll work out fine.,ans,neu
Ses02M_impro08_M011,"Yes, we'll get- we'll get rid of it right now. I mean just we're going to have to have you, um, submit something you know, we're going to have to have you mail something in for us, okay.",s,neu
Ses02M_impro08_M012,"So- So you can um find that application. You have the Internet, you can go to our website.",s,neu
Ses02M_impro08_F013,"Oh I can get the form right now? Oh, that'll be so much better.  Okay.",q,xxx
Ses02M_impro08_M013,Yeah. Yeah. You get the form right now. and- yeah,ans,neu
Ses02M_impro08_M014,"We could mail it to you as well, but-",s,neu
Ses02M_impro08_F014,-But online is faster I can do that.,s,xxx
Ses02M_impro08_M015,"Right. You can go online, print it out, and just fill out the form and um- send it to us um- you know,  regarding the grievance and-",s,neu
Ses02M_impro08_M016,and it'll get taken off um- no problem you know,s,neu
Ses02M_impro08_F015,Okay.,b,xxx
Ses02M_impro08_F016,Cause I-I just don't know how someone could have gotten my charge information,s,fru
Ses02M_impro08_F017,I mean I still have my card.,s,xxx
Ses02M_impro08_M017,Right. I mean we might,b,neu
Ses02M_impro08_M018,Okay.,b,neu
Ses02M_impro08_F018,So is there any- I mean what if they spend something again?,q,fea
Ses02M_impro08_M019,"Uh, I mean have you been shopping around on the Internet and stuff? I mean that you gave-",q,neu
Ses02M_impro08_F019,I did buy one thing on ebay I don't know that might-,ans,neu
Ses02M_impro08_M020,"Uh-ha, I mean usually sites are pretty well protected but sometimes I mean information gets out, so",s,neu
Ses02M_impro08_M021,so it is a little a little hard in that situation if you want -- you know you can -um- we can- we can issue another credit card.,o,neu
Ses02M_impro08_F020,"Oh, really?",q,sur
Ses02M_impro08_M022,"Yeah, yeah. Maybe we'll, uh-",ans,neu
Ses02M_impro08_F021,"Oh that'll be great 'cause I could just get a new number, would that be okay because that way I don't have to worry about it happening again?",o,xxx
Ses02M_impro08_M023,it's a different number and everything,s,neu
Ses02M_impro08_M024,Yeah. yeah.,ag,neu
Ses02M_impro08_M025,"Yes, um but  for- for that- for that charge we will need you to send something in but we can get you processed immediately for this, for this, for this new card. It still goes to the same address, right?",s,neu
Ses02M_impro08_F022,"Yes, absolutely.",ag,xxx
Ses02M_impro08_M026,Okay. All right. Then we'll get it sent out there. And,s,neu
Ses02M_impro08_F023,Great.,a,hap
Ses02M_impro08_M027,And you know just I mean be careful in the future if um,s,neu
Ses02M_impro08_F024,Yeah.,b,hap
Ses02M_impro08_M028,if you're ever online or anything like that I mean just make sure it's a secure site and,s,neu
Ses02M_impro08_M029,"and never you know, give it to anyone out, never even give out your number to any like unreliable company that you haven't heard of or anything like that, all right? Because, um, we want to- we definitely want to help you out, but-",s,neu
Ses02M_impro08_F025,"Right, right.",ag,neu
Ses02M_impro08_F026,"Okay, great.",a,neu
Ses02M_impro08_F027,"Yeah, totally.",ag,neu
Ses02M_impro08_M030,you know it gets- it gets difficult you know so Alright.,o,neu
Ses02M_impro08_F028,Well thank you so much. You've been very helpful. I really appreciate it.,o,hap
Ses02M_impro08_M031,"Alright Yes, I'm sorry for all the inconvenience but we'll get it taken care of.",ap,neu
Ses02M_impro08_F029,[BREATHING] Thank you.,g,xxx
Ses02M_impro08_F030,Thank you very much bye.,g,hap
Ses02M_script01_1_F001,How could he see it? I was the first one up he was still in bed.,q,xxx
Ses02M_script01_1_M001,He was out here when it broke.,ans,xxx
Ses02M_script01_1_F002,When?,q,xxx
Ses02M_script01_1_M002,About four this morning. I heard it cracking and I woke up and looked out. He was standing right here when it cracked.,ans,xxx
Ses02M_script01_1_F003,What was he doing out here at four in the morning?,q,xxx
Ses02M_script01_1_M003,I don't know. When it cracked he ran into the house and cried in the kitchen.,ans,sad
Ses02M_script01_1_F004,So you talked to him?,q,xxx
Ses02M_script01_1_M004,No. I figured it was best to leave him alone.,ans,sad
Ses02M_script01_1_F005,He cried hard?,q,xxx
Ses02M_script01_1_M005,I could hear him right through the floor in my room.,ans,sad
Ses02M_script01_1_F006,"What was he doing out here at that hour? He's dreaming about him again, he's walking around at night.",q,xxx
Ses02M_script01_1_M006,I guess he is.,ans,xxx
Ses02M_script01_1_F007,He's getting just like after he died. What is the meaning of that?,q,xxx
Ses02M_script01_1_M007,"I don't know the meaning of it, but I know one thing mom, we've made a terrible mistake with dad.",ans,xxx
Ses02M_script01_1_F008,What?,q,xxx
Ses02M_script01_1_M008,Being dishonest with him. I mean that sort of thing always pays off and now it's paying off.,ans,xxx
Ses02M_script01_1_F009,What do you mean dishonest?,q,xxx
Ses02M_script01_1_M009,You know that Larry is not coming back and I know it. Why do we allow him to go on thinking that we believe with him?,ans,fru
Ses02M_script01_1_F010,"What do you want to do, argue with him?",q,fru
Ses02M_script01_1_M010,"No I don't want to argue with him, but it's about time he realized that nobody believes Larry is alive anymore.",ans,fru
Ses02M_script01_1_M011,"Why -- why shouldn't he dream of him? Walk around, waiting for him at night I mean do we contradict him, do we say straight out that we don't have any hope anymore that we haven't had hope for years now?",q,fru
Ses02M_script01_1_F011,You can't say that to him.,ans,fru
Ses02M_script01_1_M012,We've got to say it to him.,dag,ang
Ses02M_script01_1_F012,"Can you prove it, how can you prove it?",q,fru
Ses02M_script01_1_M013,"For God sakes it's been three years, nobody comes back after three years, that's insane.",ans,ang
Ses02M_script01_1_F013,To you it is and to me. You can talk yourself blue in the face but there is no body and no grave so where are you?,q,fru
Ses02M_script01_1_M014,Sit down mom; I want to talk to you.,c,xxx
Ses02M_script01_1_F014,"The trouble is the god damned newspapers, every month or so a boy turns up out of nowhere, so the next one is going to be Larry.",s,xxx
Ses02M_script01_1_M015,All right. All right. Listen to me.,c,fru
Ses02M_script01_1_M016,You know why I brought Annie here don't you?,q,neu
Ses02M_script01_1_M017,You know.,ans,neu
Ses02M_script01_1_F015,I got an idea but what's the story?,q,neu
Ses02M_script01_1_M018,I'm going to ask her to marry me.,ans,neu
Ses02M_script01_1_F016,"Well that's only your business, Chris.",o,xxx
Ses02M_script01_1_M019,No it's not only my business.,dag,fru
Ses02M_script01_1_F017,What do you want me to do; you're old enough to know your own mind.,q,fru
Ses02M_script01_1_M020,So it's all right then I'll go ahead with it?,q,fru
Ses02M_script01_1_F018,"Well, you want to make sure that your father isn't-",s,neu
Ses02M_script01_1_M021,See it isn't just my business-,s,ang
Ses02M_script01_1_F019,I'm just saying,s,fru
Ses02M_script01_1_M022,Sometimes you infuriate me you know that. Isn't it your business to if I tell dad and he throws a fit about it? You have such a talent for ignoring things.,o,xxx
Ses02M_script01_1_F020,I ignore what I got to ignore. The girl is Larry's girl.,s,xxx
Ses02M_script01_1_M023,She's not Larry's girl.,dag,fru
Ses02M_script01_1_F021,From father's point of you he isn't dead and you have no right to take his girl.,s,neu
Ses02M_script01_1_F022,"You can go on from there if you know where to go but I don't know where to go, see I don't know. So what can I do for you?",q,fru
Ses02M_script01_1_M024,"I don't know why but every time I reach out for something that I really want, I have to pull back 'cause someone else will suffer. My whole bloody life, time after time after time.",o,ang
Ses02M_script01_1_F023,You're a considerate fellow.  There's nothing wrong with that.,o,neu
Ses02M_script01_1_M025,To hell with that.,dag,ang
Ses02M_script01_1_F024,Have you asked Annie yet?,q,fru
Ses02M_script01_1_M026,I wanted to get this settled first.,ans,neu
Ses02M_script01_1_F025,How do you know she'll marry you? Maybe she feels the same way your father does.,q,neu
Ses02M_script01_1_M027,"Well, if she does then that's the end of it. From her letters I think she's forgotten him.",ans,neu
Ses02M_script01_1_M028,"I don't know, I'll find out. Then we'll trash it out with dad, right? Mom, don't avoid me.",c,sad
Ses02M_script01_1_F026,"Trouble is you don't see enough women, you never did.",o,ang
Ses02M_script01_1_M029,So what I'm not fast with women.,s,fru
Ses02M_script01_1_F027,I just don't see why it has to be Annie.,q,ang
Ses02M_script01_1_M030,Because it is.,ans,fru
Ses02M_script01_1_F028,That's a good answer but it doesn't answer anything. I mean you haven't seen her since you went away to war it's five years.,s,fru
Ses02M_script01_1_M031,"I can't help it I know her best. I mean lived next door to her my whole life. These years when I think of a wife, I think of Annie.",o,fru
Ses02M_script01_1_M032,"What do you want, a diagram?",q,xxx
Ses02M_script01_1_F029,"I don't want a diagram. He thinks he's coming back. Chris, you marry this girl you're pronouncing him dead.",ans,fru
Ses02M_script01_1_F030,"Do you know what's going to happen to your father because I don't, see?",q,fru
Ses02M_script01_1_M033,All right. All right. Mom.,a,xxx
Ses02M_script01_1_F031,Just give it some more thought.,c,xxx
Ses02M_script01_1_M034,"I've given it three years of thought. I thought that if I waited, dad would forget about Larry and we could have a regular wedding and everything happy.",o,xxx
Ses02M_script01_1_M035,"If I can't do that here well, then I'll have to get out.",o,sad
Ses02M_script01_1_F032,What the hell is this?,q,ang
Ses02M_script01_1_M036,"I'll get out. I'll get married and go live some place else, maybe New York.",ans,sad
Ses02M_script01_1_F033,"What the hell is this, are you crazy?",q,ang
Ses02M_script01_1_M037,"I've been a good son too long a good sucker, I'm through with it.",ans,ang
Ses02M_script01_1_F034,What about the business? What is this?,q,ang
Ses02M_script01_1_M038,The business?  The business doesn't inspire me.,ans,ang
Ses02M_script01_1_F035,Must you be inspired?,q,ang
Ses02M_script01_1_M039,"Yes, I like it and hour a day. If I'm going to grub for money all day long, at least in the evening I want it beautiful.",ans,ang
Ses02M_script01_1_F036,"Tell me, you'd leave the business?",q,ang
