TURN,UTTERANCE,DA,EMOTION
Ses02F_impro01_M000,Hi.,g,neu
Ses02F_impro01_M001,"Okay.  Let me see here.  Um, we need--we need your original birth certificate.",s,neu
Ses02F_impro01_F001,My--my original birth certificate?  But I don't carry that with me.,s,sur
Ses02F_impro01_M002,Right.  Well.  We still need it.,s,neu
Ses02F_impro01_F002,"Well, I have my driver's license, does that work?",q,xxx
Ses02F_impro01_M003,"No. no  Uh, no one told you that you needed your original birth certificate.",q,xxx
Ses02F_impro01_F003,No it doesn't say it on the form.,ans,fru
Ses02F_impro01_F004,"I mean it just says that you need some form of identification, but it doesn't say what kind of identification.",s,fru
Ses02F_impro01_F005,I mean if I had known--I would have brought it.,o,fru
Ses02F_impro01_M004,um Sorry.,ap,neu
Ses02F_impro01_M005,"Okay.  Um, I'm sorry but I--I can't help you.  You're gonna have to go back and uh...",ap,fru
Ses02F_impro01_F006,"Look, I've been waiting in line for a really long time.  I mean, you've seen how long it is.",s,fru
Ses02F_impro01_F007,It's lunch hour.,s,fru
Ses02F_impro01_M006,Right.  It's the D.M.V..,ag,fru
Ses02F_impro01_M007,"I know, it gets long, but I can't do anything without your--do you have Social Security card, maybe?",q,fru
Ses02F_impro01_F008,"Well, no.  I mean, I don't carry my original documents with me because if those things get destroyed, then what do you, you know what I mean, like if I loose my wallet or something, I'll never have them again.",ans,fru
Ses02F_impro01_F009,I have my passport and I have my driver's license. And that's all I have.,s,fru
Ses02F_impro01_M008,"Alright, I don't know what to tell you right.",o,fru
Ses02F_impro01_M009,"I think you're just gonna--you're gonna have to get 'em and then you can back and then, we'll help you out.  Maybe, we can-",s,fru
Ses02F_impro01_F010,"But, isn't there anything you can do.  Can't you make an exception this one time?  My picture is on both of those identifications.  It's not like you don't know that it's me.",q,fru
Ses02F_impro01_M010,I can't.,ans,fru
Ses02F_impro01_F011,And I can give you my social--,s,fru
Ses02F_impro01_M011,"I make an exception for you and I have to make an exception for everyone.  I mean, I-I've seen this before and I know it's frustrating, but there's nothing I can do. You just have to-",o,fru
Ses02F_impro01_F012,"Well, I can give you my Social Security Number.",s,fru
Ses02F_impro01_M012,"No, it's--",dag,fru
Ses02F_impro01_F013,And I can tell you where I was born and what time and by who and what day.,s,fru
Ses02F_impro01_M013,"Okay.  But how do I--that's- that's not proof to me.  How do I know that, you know, that it's really you.  I need--",q,fru
Ses02F_impro01_F014,I can't go--I have to go back to work.  I don't have time to go back to my house and get all of that stuff and then get back in line and wait for another forty five minutes.,ans,fru
Ses02F_impro01_M014,"Well, the weekends are not as busy.  Maybe you can uh, come and try to get here early--",o,fru
Ses02F_impro01_F015,"Um, I have kids.  I have to take them places on the weekends.  I don't have time to come back here.  Please.  I really need you to help me.",o,fru
Ses02F_impro01_M015,I can't.  There's nothing I can do.  I'm sorry.,ap,fru
Ses02F_impro01_F016,Well.  [BREATHING] I just--I just don't.  I-I'm sorry that I'm standing here-- But I can't leave. I-,ap,fru
Ses02F_impro01_M016,The line--,b,xxx
Ses02F_impro01_F017,"I really need this done today.  As you can see, the deadline is almost up and I can't come back.",o,fru
Ses02F_impro01_M017,"Ok, but you're right now you're holding up more people in line by standing here-- and letting",s,ang
Ses02F_impro01_F018,"Well, why didn't the D.M.V. put that you needed your birth certificate on the application then?",q,ang
Ses02F_impro01_M018,"I--when you're going to the D.M.V., you usually need pretty professional identification--",ans,fru
Ses02F_impro01_M019,"You know, Official documentation--",s,ang
Ses02F_impro01_F019,"Yeah, but your birth certificate--I mean, who carries around their birth certificate?  Nobody does that.",o,ang
Ses02F_impro01_M020,"No, but you come--you come to the D.M.V., it's something-- You should've- You should've figured--",dag,fru
Ses02F_impro01_F020,With your driver's license and your passport.  Just like everybody else.,s,ang
Ses02F_impro01_M021,"But, without your drive--where-where- what about your identification without your driver's license?  I mean, you need--you needed something before then?",q,fru
Ses02F_impro01_F021,"Who--you always use your driver's license.  I mean, you're not coming to the D.M.V. if you're not over sixteen and that's when you get your driver's license so you're never gonna need it anyway.",ans,ang
Ses02F_impro01_M022,"All right.  Well, um, you know, I'd love to help you, but--nothing I can do.",s,fru
Ses02F_impro01_M023,"So, if you wanna go get your birth certificate, um, maybe come back--I don't--maybe you can talk to the person in the--in the front of line maybe.  I don't know.",o,fru
Ses02F_impro01_F022,Do you have a supervisor?,q,fru
Ses02F_impro01_M024,I am the supervisor.  So--,ans,fru
Ses02F_impro01_F023,"Well, thank you very much.  You've been very helpful.",g,fru
Ses02F_impro02_F000,It's almost time for me to go.,s,sad
Ses02F_impro02_M000,I can't believe that--now--are you sure this is absolutely necessary?  Like--,q,xxx
Ses02F_impro02_F001,"There's nothing I can do.  I mean, the government you know--",ans,sad
Ses02F_impro02_M001,What--what're we gonna do here?  I can't--I can't do this by myself.  I--,q,fru
Ses02F_impro02_F002,"You're gonna have to.  I mean, you're a great father.  You can do it.  I know you can.",ans,sad
Ses02F_impro02_M002,"But, I'm--I'm nothing--I'm nothing without you here.  Maybe we can--we can get out of this somehow.",o,fru
Ses02F_impro02_F003,I don't think so.,dag,sad
Ses02F_impro02_M003,"Well, come on.  You've gotta think of something.  A year--a year away, it's gonna tear us apart.  I don't even--I don't even wanna think about it.  I mean, I don't even know if I'll be able to get in touch with you or--",o,fru
Ses02F_impro02_F004,"Well, we can do the best we can and-and, with um, you know like wireless internet these days--I think that we could-- Talk every once in awhile.",o,sad
Ses02F_impro02_F005,You could send me pictures.,o,sad
Ses02F_impro02_M004,It's not going to be the same.,o,xxx
Ses02F_impro02_M005,"What if--maybe--what if, uh, we went somewhere over there?  I don't--I don't know--I--I need to figure something out for this because--",q,fru
Ses02F_impro02_F006,"Their not gonna let you.  You have to stay home and I have to go.  I mean, that's all--",ans,sad
Ses02F_impro02_F007,"and--I mean, my daughter--I don't want to put her in danger.  You know?  She has to stay.",o,sad
Ses02F_impro02_M006,This is gonna be a--a crucial yet--she's--she's growing up.  She's gonna need you.,o,fru
Ses02F_impro02_M007,But she's--you're not gonna--you're not gonna be here for--for her first words.  For her first steps.  I mean--it's something that you're supposed to be here for that--,o,sad
Ses02F_impro02_F009,You can just remember it for me.,c,sad
Ses02F_impro02_M008,I don't know--I don't know--I don't know how--I don't know how this could even be possible for you--I--if I was--,dag,fru
Ses02F_impro02_F010,"Well, I need--I need you to be able to do this for me 'cause I can't do anything about it.",o,sad
Ses02F_impro02_F011,"I mean, it's just as hard for me, but--I know that we can do it, you know",o,sad
Ses02F_impro02_M009,"I mean, you just get to--go off and do your thing.  I mean, yeah, we're both--I don't know--it's bad for both of us, but--",o,fru
Ses02F_impro02_M010,...it would be so much better if we can--if we could stay together somehow.  You know--we could--we could do this together.,o,fru
Ses02F_impro02_F012,I don't want you in danger.  And I don't want her in danger.,o,sad
Ses02F_impro02_M011,I don't want you in danger.  Where are you going?  You're going over to war.,s,xxx
Ses02F_impro02_F013,I have no choice. There's nothing I can do.,o,sad
Ses02F_impro02_M012,All right.,ag,sad
Ses02F_impro03_F000,"Oh my God.  Guess what, guess what, guess what, guess what, guess what, guess what?",q,exc
Ses02F_impro03_M000,What?,q,xxx
Ses02F_impro03_F001,"Well, guess.  Guess, guess, guess, guess.",c,exc
Ses02F_impro03_M001,"Um, you--",b,neu
Ses02F_impro03_F002,Don't look at my left hand.,c,xxx
Ses02F_impro03_M002,No.  Let me see.,dag,sur
Ses02F_impro03_M003,"Oh, no way.",s,xxx
Ses02F_impro03_F003,"He proposed.  He proposed.  Well, and I said yes, of course. [LAUGHTER]",s,xxx
Ses02F_impro03_M004,That is great.  You look radiant.  I should've guess.,o,hap
Ses02F_impro03_F004,I'm so excited.,o,exc
Ses02F_impro03_M005,"Well, Tell me about him.  What happened.",q,exc
Ses02F_impro03_F005,"Remember how we had that date?  And I was like, oh yeah, this is a date, whatever.",q,xxx
Ses02F_impro03_F006,"So after we sort of went out dinner and I was already like tired.  I wasn't all that excited and and so he's like let's go down to the beach and I was like no I don't want to the beach, like I'm tired. And he's like no, no we have to go.  And I was like okay, like that's a little weird.",s,xxx
Ses02F_impro03_F007,"So, he--so we walked down to the pier and there's like these lights--like these little, like lights-- and we're like what's that? And he's like I don't know let's go find out.",s,xxx
Ses02F_impro03_F008,So we walked down there and there's-[LAUGHTER]-And there's- this huge like ten foot heart in candles on the beach--,s,xxx
Ses02F_impro03_M006,What?,q,sur
Ses02F_impro03_F009,"like all they have And I was like, what's going on?  And he like takes my hand and pulls me into the middle and he's like--you know, get's on his knee and everything--And says will you marry me? And I flipped out.",s,exc
Ses02F_impro03_M007,That--that is the most romantic thing I have ever heard.,o,sur
Ses02F_impro03_F010,"I know.  I was like, how did he get--like he must have called someone or had them set--like, I have no idea.",o,xxx
Ses02F_impro03_M008,"Wow.  Yeah, 'cause yeah I don't know I'm sure if he--oh yeah he definitely had--would have had to have someone else--",ag,xxx
Ses02F_impro03_F011,Cause- 'Cause he was with me. You didn't do it did you?,q,exc
Ses02F_impro03_M009,"Yeah.  I mean candles wouldn't stay--No, I didn't--I didn't know anything about it.",ans,hap
Ses02F_impro03_F012,You didn't know anything?,q,exc
Ses02F_impro03_M010,No. I'm just as happy as you are.  This is--,ans,hap
Ses02F_impro03_F013,"I was just--it was so like I thought this might happen eventually, but like not yet, you know what I mean?  Like--",o,exc
Ses02F_impro03_M011,"So, I mean--it's good though.",o,hap
Ses02F_impro03_F014,"It is good.  It's totally good.  I mean, it like oh, you know.",ag,exc
Ses02F_impro03_M012,"Yeah, I know.  Wow.  I'm shaking.  I can't even--",s,exc
Ses02F_impro03_F015,I know. So we're gonna take it--Like we're not gonna get married right away--'Cause we want to like have plenty of time to plan everything out,s,hap
Ses02F_impro03_F016,"...and, um, my parents want to like be part of it and help out and everything--So we want to give it lots of time to like--",s,hap
Ses02F_impro03_M013,"Oh. Do they--do they know yet? Have you told them? Oh, that's--",q,neu
Ses02F_impro03_F017,"Yeah, yeah, I called them. I called them And, of course, they were so excited 'cause they love him. Like they always have.  Um--",ans,hap
Ses02F_impro03_M014,That's great.  Yeah.,ag,neu
Ses02F_impro03_F018,"So, yeah, I mean, it'll be good.  We wanna like, uh, I think we're gonna have it in spring time, like early Spring--So it's no too hot yet.  And um--",s,hap
Ses02F_impro03_M015,Okay. You know--you know where?  Or--,q,neu
Ses02F_impro03_F019,"I don't know.  I mean, I kinda like the idea of having something outside, but--Like--is a- Yeah,",ans,hap
Ses02F_impro03_M016,"Uh, huh. I mean, you know, it's spring--It'll be--",ag,neu
Ses02F_impro03_M017,Spring's nice though.,o,neu
Ses02F_impro03_F021,"Yeah, I don't know-[LAUGHTER]-I mean--I can't even--the whole idea of like living--spending my whole life with somebody--that's crazy",o,exc
Ses02F_impro03_M018,"Yeah, that is--how long you guys been together now?",q,neu
Ses02F_impro03_F022,Two and a half years. [LAUGHTER],ans,xxx
Ses02F_impro03_M019,Okay.  All right.  So-[LAUGHTER]-quite a while.  I mean--That's-  That's good.  I'm so happy for you. [LAUGHTER],ag,hap
Ses02F_impro03_F023,Thank you. Thank you so much.,g,hap
Ses02F_impro03_M020,"Yeah, I'd love to be in that same situation some day, but, wow- so-",o,hap
Ses02F_impro03_F024,"Oh, you will--You'll find just the right girl.  And she'll be perfect for you and everything will be great.",o,exc
Ses02F_impro03_M021,You guys are awesome together.  It's definitely a--definitely a good couple.  I can see it. I should've guessed--,o,xxx
Ses02F_impro03_F025,You approve?  You approve?,q,xxx
Ses02F_impro03_M022,"Oh, I approve. I-[LAUGHTER]-I more than approve.",ans,hap
Ses02F_impro03_M023,"I mean, I'm surprised he didn't, ya know--go get a plane to fly over and shine--But candles on the beach, that's okay too I guess--",o,hap
Ses02F_impro03_F026,"Yeah, it's pretty good.",ag,hap
Ses02F_impro03_M024,"Well--can--I mean, let me know--I want- I want invitations and--",c,exc
Ses02F_impro03_F027,"Of course, of course--you'll be able to be a part of it.  You can come help me pick my colors.",ag,hap
Ses02F_impro03_M025,"Oh, yes.  This is the whole [GARBAGE]",ag,exc
Ses02F_impro03_F028,"It's so girly.  I don't even know how to like--It's so weird, but it'll be fun.  My mom will love to be like--she'll get so into it, I'm sure.",o,exc
Ses02F_impro03_F029,She'll be like--flowers and the--,s,hap
Ses02F_impro03_M026,"It'll be good.  Wow, that's great.",o,hap
Ses02F_impro03_F030,"Oh, thank you. [LAUGHTER]",g,hap
Ses02F_impro04_M000,"So, uh, so how's it been going?  I mean, you have any needs or anything?",q,neu
Ses02F_impro04_F000,I'm--every lead that I get ends up just being a dead end.  You know what I mean.  People are sick of me calling--,ans,fru
Ses02F_impro04_M001,"No.  You can't think that way.  I mean it's good--it's good that you're--that you're calling, you know. you can't",o,neu
Ses02F_impro04_F001,"Yeah, but it--I mean it's the same response you get over and over again.  Like--",s,fru
Ses02F_impro04_F002,"Oh, we're not hiring at this time or thank you, we already have your information on file--We'll call you when we're ready.",s,fru
Ses02F_impro04_M002,"Yeah--I know what you mean.  I've gone through like similar stuff, but--",s,xxx
Ses02F_impro04_F003,"But, it's been so long, like--I mine as well just take a job at McDonald's.  Like, I don't--",o,fru
Ses02F_impro04_M003,"No, come on.  Don't [GARBAGE]",dag,neu
Ses02F_impro04_F004,"I just--I can't do it anymore.  Like, it just takes it out of you--",o,fru
Ses02F_impro04_M004,"I know.  I know. It's hard, but you just--you gotta keep going.  I mean, you've been going at it for so long, you know.  Something is definitely going to come up.  I-I know it will, because you're a good worker--",o,neu
Ses02F_impro04_F005,I just keep getting rejected.  I just keep getting rejected over and over and over again and it starts to make you feel like there must be something wrong with you that you can't get a job.,s,fru
Ses02F_impro04_M005,"No.  It's--I mean, it's competitive, you know.  That's-That's what it is.  that's what you gotta be is competitive.",o,neu
Ses02F_impro04_F006,"Yeah, but maybe--if just because it's competitive, like maybe I'm just not good enough.  Maybe the level is here and I'm here and there's just no way I'm ever gonna do that--",o,fru
Ses02F_impro04_M006,"There...There are plenty of people out there with--with like, good jobs, you know, that are a lot...",s,neu
Ses02F_impro04_M007,...dumber than you.  I mean they're a lot worse off than you.  You are much better off than like a lot of those people in there. I know,o,neu
Ses02F_impro04_F007,"I didn't have like one of those starts, you know, like a family member who was already in the business or something you know that could like give me a helping hand.",s,fru
Ses02F_impro04_M008,"I know.  It makes it harder.  I mean it's definitely who you know in a lot of cases, but--",ag,neu
Ses02F_impro04_F008,"It's just so frustrating.  Like, I just--I just don't wanna do it anymore.  You know?  I just don't wanna like hit the pavement every single day with my resumes and going out there all the time.  You know, it's just like--",o,fru
Ses02F_impro04_M009,"But you gotta.  Otherwise, what is--what's your other option?",q,neu
Ses02F_impro04_F009,I feel so worthless.,o,sad
Ses02F_impro04_M010,"It's not worthless 'cause it's definitely gonna--it's definitely gonna pay off.  I know it.  I mean, I can--I've just--I've seen your work etiquette.  You know, you're a good worker and...",dag,neu
Ses02F_impro04_M011,... and there's no reason that--that something won't come up like really soon.  All right?  So you just gotta--,o,neu
Ses02F_impro04_F010,And what would make you say that?  There doesn't seem to be any indicators that anything's going to get better.,q,fru
Ses02F_impro04_M012,"Because I know you.  You know, and maybe once you get to know some more people, like talking to them and everything, they'll get to know you too and they'll realize they should've hired you three years ago.  You know? but  And- and they'll finally come around and believe me--it'll--you gotta-",ans,neu
Ses02F_impro04_F011,"It's just really hard.  I feel like their starting to get like a personal prejudice against me.  You know what I mean?  Like it's like suddenly it starts to feel like it's just you that they say no to and it's not that they're not taking applications and it's not that they're not hiring people, it's just you particularly they have some particular reason for just hating you.  You know?",o,fru
Ses02F_impro04_M013,"Well maybe yeah, but maybe you get to that point where it's like you bug 'em and then they just don't wanna hear from you anymore, but you keep bugging them and bugging them and then it's gonna annoy them so much that they're gonna be like all right fine. you know",o,neu
Ses02F_impro04_F012,Or they'll never talk to me again.,o,fru
Ses02F_impro04_M014,"Or, well, no.  Okay. you -[GARBAGE]",dag,fru
Ses02F_impro04_F013,"I-I just I think maybe I should try something else.  I mean, I-I don't know.  All growing up this is the only thing that I ever wanted to do and yet I can't.  I'm not physically able apparently.  I mean--",o,fru
Ses02F_impro04_M015,"That obviously that's not true though.  I mean, you've done this before.  You've done all the work like this before, you know, and and you've gotten people saying oh, you're so good and like you know--",dag,neu
Ses02F_impro04_F014,"I guess the money shouldn't matter to me, but--Somehow it does.  You know? It's not like I do it for the money, but",o,fru
Ses02F_impro04_M016,Right.,b,neu
Ses02F_impro04_M017,"Well, you've gotta live.",s,neu
Ses02F_impro04_F015,"you have to--I mean, if you're hired by somebody, then you're not a professional, you're an amateur and that means that you're not good enough.",o,fru
Ses02F_impro04_M018,"I mean, it's just, it's really--I don't know, yeah, it's about their opinions and it's about, I don't know, just getting yourself out there and--",s,neu
Ses02F_impro04_F016,"I just wanna crawl in a hole, you know.  Like it just makes you not wanna even open your eyes in the morning.",o,sad
Ses02F_impro04_M019,"Well, come on, come on.  Thinking about it like this is definitely not gonna help either though.",o,neu
Ses02F_impro04_F017,I don't know how to get out of it.  I don't know how to dig myself out of it.  It's the same hole that I've been digging and digging and digging.  I can't--,s,xxx
Ses02F_impro04_M020,I don't know.,s,xxx
Ses02F_impro05_F000,"Hi, um, excuse me, I believe that the airline lost my baggage.",s,neu
Ses02F_impro05_M000,"Um, okay, it didn't--didn't come out on the carrousel--",q,neu
Ses02F_impro05_F001,"No, it didn't. um It didn't come out and I don't see it anywhere around here, so what can you do about that?",q,neu
Ses02F_impro05_M001,"Okay.  Um, well, unfortunately yeah there was a some- some problems with the--",ans,neu
Ses02F_impro05_F002,Some problems?  What is that supposed to mean?,q,sur
Ses02F_impro05_M002,"Uh, well some-some of the bags were--were lost on the way over here. uh-",ans,neu
Ses02F_impro05_F003,How do you lose a suitcase?  A huge suitcase?,q,sur
Ses02F_impro05_M003,"You know, I mean, there's a lot of things that go on under the plane and sometimes, you know, that kind of things happen.",ans,neu
Ses02F_impro05_M004,"Uh, But, we are willing to reimburse you for the bag and and for the contents--",s,neu
Ses02F_impro05_F004,How much?,q,neu
Ses02F_impro05_M005,"Um, we'd be willing to give you uh fifty dollars for--",ans,neu
Ses02F_impro05_F005,"Fifty dollars?  For my suitcase?  I mean, the suitcase itself was like a hundred and fifty dollar just for the suitcase, but all the things inside, all my clothes, all my personal belongings, the sentimental value, not to mention, which is more-more than all of that together.",s,sur
Ses02F_impro05_M006,"Right.  Uh We realize, you know, that that it's a bad situation, but I'm sorry, there's nothing that we can really do.",ag,neu
Ses02F_impro05_F006,"That's all, that's all, that's all you're going to do is just give me fifty dollars and say go have fun on your vacation without any of your stuff?",q,ang
Ses02F_impro05_M007,"I think, um, maybe you can file a claim if you want and turn it in to our main office--",s,neu
Ses02F_impro05_F007,"Yes, yes, I would like to file a claim, but what are you gonna--I mean, is it just gonna show up magically out of nowhere?",q,fru
Ses02F_impro05_M008,"Right.  No.  I mean they- they might--they might--if you-if you are argue the case more, maybe they'll reimburse you more, but, right now--",dag,neu
Ses02F_impro05_F008,"I need my stuff.  It's--I need my stuff.  I mean, uh...",c,xxx
Ses02F_impro05_F009,Haven't you ever lost baggage?  I mean isn't there anything else you do?,q,xxx
Ses02F_impro05_M009,"Yes, I know. I know-. It's It's frustrating.  Unfortunately though-- um",ans,neu
Ses02F_impro05_F010,"Because you don't seem to care very much, you know.",o,ang
Ses02F_impro05_M010,"By checking your bags, you--you, you know- admit to the liability that's- that's at risk--",s,neu
Ses02F_impro05_F011,I didn't sign anything.,s,fru
Ses02F_impro05_M011,"Right, well, by checking in your bags, you agreed to, you know, at the will of the--",s,neu
Ses02F_impro05_F012,"I didn't agree.  [GARBAGE] I paid the airline to take care of things for me.  When you pay for something, there should be some sort of guarantee that it's gonna come through.",o,xxx
Ses02F_impro05_M012,"You paid for the flight and then your bags were checked at--it's a service that the airline provides for us.  So so, really, it's really the risk was taken and, I'm sorry, but there's really nothing else we can do.  So do you want--do you want the reimbursement?",s,neu
Ses02F_impro05_F013,"[BREATHING] Well, sure, yeah, I guess I'll go buy dinner and then be--have nothing for the rest of my entire vacation.  I'm supposed to be here for three weeks.  What am I gonna do without anything for three weeks?",q,fru
Ses02F_impro05_M013,"Well, there are-there are some shops here in- in the airport--",ans,neu
Ses02F_impro05_F014,But fifty dollars isn't going to get me anything.,s,fru
Ses02F_impro05_M014,"No, um, like I said you can file a claim and, uh, maybe get reimbursed for more-- you",s,neu
Ses02F_impro05_F015,Isn't there anything else you can do?,q,fru
Ses02F_impro05_M015,probably even talk to--,s,neu
Ses02F_impro05_F016,"I mean, is there somebody you can call?  Or the guy that put the stuff on the--on the plane.  I mean, are they--they must be really irresponsible to have just disappeared my baggage.  I mean, did it get stolen?",q,fru
Ses02F_impro05_M016,"Right, that--that gets taken care of-- That gets taken care of.  We get we do, you know, we investigate those and just make sure that um- they're not doing their own thing with them so--uh",ans,neu
Ses02F_impro05_F017,"Yeah, I'm sure you -- You're like, hmm, do you take baggage?  No.  Oh, okay, thanks.  Great.  I mean how--",s,fru
Ses02F_impro05_M017,but Unfortunately sometimes is--,s,neu
Ses02F_impro05_M018,"Well, that's--that's what I'm saying--",s,neu
Ses02F_impro05_F018,There needs to be better security here.,o,fru
Ses02F_impro05_M019,"Okay.  Well that that could be something that you put on on the claim--on on the complaint form if you want.  And provide us with your information while you're here and then, maybe, if it turns up, then we'll send it right over.",o,neu
Ses02F_impro05_F019,It sounds like it's such a little like oh well no big deal whatever.  It's a big deal to me.,s,ang
Ses02F_impro05_M020,"All right, Miss, I-I know.  I realize this. But Like I said, there are several people that are in your same situation, so, um, it's not--it's not totally uncommon and I'm actually gonna have to ask you to move so I can help the next person.",s,neu
Ses02F_impro05_F020,"Well, can I at least have my fifty dollars, please?",c,fru
Ses02F_impro05_M021,"Yes, all right.  There you go, now you can file a claim over to the left--And they'll help you out.",s,neu
Ses02F_impro05_F021,Thank you.,g,xxx
Ses02F_impro05_F022,Thank you very much.,g,fru
Ses02F_impro06_M000,"Hey, a what's up?",g,neu
Ses02F_impro06_F000,"Um, Johnny died yesterday.",s,sad
Ses02F_impro06_M001,"Wow, that's horrible.",o,neu
Ses02F_impro06_M002,I'm sorry to hear about that.,ap,neu
