TURN,UTTERANCE,DA,EMOTION
Ses02F_script03_1_M027,"Ah, horrible thing.  I hated it.",o,xxx
Ses02F_script03_1_F024,"Yes, I know you did.  You threw it out of the window into the Grand Canal.  I don't think I'll ever forgive you for that.",ag,hap
Ses02F_script03_1_M028,How long did that row last?,q,neu
Ses02F_script03_1_F025,It went in intermittently for days.,ans,hap
Ses02F_script03_1_M029,The worst one was in Cannes when your curling iron burnt a hole in my new dressing gown.,s,neu
Ses02F_script03_1_F026,It burned my comb too and all the towels in the bathroom.,s,hap
Ses02F_script03_1_M030,"That was a rouser, wasn't it?",q,xxx
Ses02F_script03_1_F027,That was the first time you ever hit me.,ans,neu
Ses02F_script03_1_M031,I didn't hit you very hard.,o,neu
Ses02F_script03_1_F028,"The manager came in and found us rolling around on the floor, biting and scratching like panthers.",s,hap
Ses02F_script03_1_M032,"Oh, I'll never forget his face.",s,exc
Ses02F_script03_1_F029,It was ridiculous.  Completely ridiculous.,o,exc
Ses02F_script03_1_M033,We were very much younger then.,s,neu
Ses02F_script03_1_F030,and very much sillier,o,xxx
Ses02F_script03_1_M034,"As a matter of fact, the real cause of that row was Peter Burden.",s,neu
Ses02F_script03_2_M001,I knew nothing of the sort.  You took presents from him.,s,neu
Ses02F_script03_2_F001,Presents?  Just a trivial little broach.,s,xxx
Ses02F_script03_2_M002,"Ah, yes, I remember it well.  Bristling with diamonds in the worst possible taste.",s,xxx
Ses02F_script03_2_F002,"No, it wasn't.  It was very pretty.  I still have it and I wear it often.",dag,xxx
Ses02F_script03_2_M003,You went out of your way to torture me over Peter Burden.,s,xxx
Ses02F_script03_2_F003,"No, I didn't.  You worked the whole thing up in your jealous imagination.",dag,xxx
Ses02F_script03_2_M004,"You must admit, he was in love with you, wasn't he?",q,xxx
Ses02F_script03_2_F004,"Just a little perhaps, nothing serious.",ans,xxx
Ses02F_script03_2_M005,You let him kiss you.  You said you did.,s,xxx
Ses02F_script03_2_F005,"Well, what of it?",q,xxx
Ses02F_script03_2_M006,What of it?,b,ang
Ses02F_script03_2_F006,It didn't hurt him at all and I enjoyed it.,s,xxx
Ses02F_script03_2_M007,"Well, what about me?",q,ang
Ses02F_script03_2_F007,"Well, if you hadn't been so suspicious and nosey, you never would have known a thing about it.",ans,neu
Ses02F_script03_2_M008,"Well, that's a nice point of view I must say.",o,xxx
Ses02F_script03_2_F008,I'm bored with this conversation.,o,xxx
Ses02F_script03_2_M009,"Me, too.  Bored stiff.  You want some brandy?",q,neu
Ses02F_script03_2_F009,"No, thanks.",ans,xxx
Ses02F_script03_2_M010,I think I'll have some.,s,xxx
Ses02F_script03_2_F010,Don't see why you want any.  You've already had two glasses.,s,xxx
Ses02F_script03_2_M011,No particular reason.  Anyhow they were very small ones.,s,neu
Ses02F_script03_2_F011,Just seems so silly to go on and on and on with such a thing.,o,neu
Ses02F_script03_2_M012,You can hardly call three liquor glasses in a whole evening going on and on and on.,o,fru
Ses02F_script03_2_F012,"Well, it's become a habit with you.",o,neu
Ses02F_script03_2_M013,"You needn't be so grand, just because you don't happen to want any yourself at the moment.",o,ang
Ses02F_script03_2_F013,Don't be so stupid.,o,ang
Ses02F_script03_2_M014,"Really, Amanda.",dag,xxx
Ses02F_script03_2_F014,What?,q,ang
Ses02F_script03_2_M015,Nothing.,ans,fru
Ses02F_script03_2_M016,Going out somewhere dear?,q,xxx
Ses02F_script03_2_F015,"No, just making myself fascinating for you.",ans,xxx
Ses02F_script03_2_M017,That reply has broken my heart.,s,xxx
Ses02F_script03_2_F016,"A woman's job is to allure the man.  Watch me a minute, will you?",o,exc
Ses02F_script03_2_M018,"As a matter of fact, that's perfectly true.",ag,xxx
Ses02F_script03_2_F017,"No, it isn't.",dag,fru
Ses02F_script03_2_M019,"Yes, it is.",dag,fru
Ses02F_script03_2_F018,"Oh, be quiet.",c,ang
Ses02F_script03_2_M020,"Ah, it's a pity you didn't have any more brandy.  It might have made you a little less disagreeable.",o,xxx
Ses02F_script03_2_F019,Doesn't seem to have worked such wonders with you.,o,fru
Ses02F_script03_2_M021,"Snap, snap, snap, like a little adder.",o,fru
Ses02F_script03_2_F020,"Adders don't snap, they sting.",dag,ang
Ses02F_script03_2_M022,Nonsense.  They have a little bag of venom behind their fangs and they snap.,dag,fru
Ses02F_script03_2_F021,They sting.,dag,xxx
Ses02F_script03_2_M023,They snap.,dag,fru
Ses02F_script03_2_F022,"I don't care, do you understand?  I don't care.  I don't care if they bark or roll about like hoops.",o,fru
Ses02F_script03_2_M024,Did you see much of Peter Burden after our divorce?,q,xxx
Ses02F_script03_2_F023,"Yes, I did.  Quite a lot.",ans,xxx
Ses02F_script03_2_M025,"Hmm, I imagine you let him kiss you a good deal more then.",o,xxx
Ses02F_script03_2_F024,Mind your own business.,c,fru
Ses02F_script03_2_M026,"Oh, must have had a riotous time. No restraint at all.  Very enjoyable and never had much anyhow.",o,xxx
Ses02F_script03_2_F025,You're quite insufferable,o,ang
Ses02F_script03_2_M027,I'm not in the least drunk.,dag,ang
Ses02F_script03_2_F027,You've always had a weak head.,o,xxx
Ses02F_script03_2_F028,"On the contrary, a child of two could get violently drunk on only one glass of brandy.",o,fru
Ses02F_script03_2_M029,"Oh, very interesting.  How about a child of four?  A child of six?  Or a child of nine?",q,fru
Ses02F_script03_2_F029,Shut up.,c,ang
Ses02F_script03_2_M030,"We could get a good debate going about this, don't you think?  Intemperate tots.",o,ang
Ses02F_script03_2_F030,"Not very funny, dear.  You'd better have some more brandy.",o,fru
Ses02F_script03_2_M031,All right.  I will.,ag,xxx
Ses02F_script03_2_M032,"You better turn that off, I think.",o,xxx
Ses02F_script03_2_F031,Why?,q,ang
Ses02F_script03_2_M033,Because it's late and it'll annoy the people upstairs.,ans,fru
Ses02F_script03_2_F032,There aren't any people upstairs.  It's a photographer's studio.,s,fru
Ses02F_script03_2_M034,There are people downstairs I suppose?,q,fru
Ses02F_script03_2_F033,They're away in Tunis.,ans,xxx
Ses02F_script03_2_M035,This is no time of the year for Tunis.,o,fru
Ses02F_script03_2_F034,"Turn it on again, please.",c,ang
Ses02F_script03_2_M036,I'll do no such thing.,dag,ang
Ses02F_script03_2_F035,"Very well, if you insist on being boorish and idiotic.",dag,ang
Ses02F_script03_2_M037,Turn it off.  It's driving me mad.,c,ang
Ses02F_script03_2_F036,You are far too temperamental.  Try to control yourself.,o,ang
Ses02F_script03_2_M038,Turn it off.,c,ang
Ses02F_script03_2_F037,Stop it.  Go away.  I hate you.,c,ang
Ses02F_script03_2_M039,"Amanda, listen. listen",c,ang
Ses02F_script03_2_F038,"Listen?  Listen, indeed.  I am sick and tired of listening to you, damn sadistic bully.",o,ang
Ses02F_script03_2_M040,"Very amusing, indeed.",dag,fru
Ses02F_script03_2_F039,"I hate you.  Stop it.  Stop it.  I hate you, do you hear?  You're conceited and overbearing and utterly impossible.",o,ang
Ses02F_script03_2_M041,"You're a vile, tempered, loose living, wicked little beast and I hope to never see you again as long as I live.",o,ang
Ses02F_script03_2_F040,This is the end.  Finally and forever.  Do you hear me?  The end.,s,ang
Ses02F_script03_2_M042,You're not going like this.,c,ang
Ses02F_script03_2_F041,"Oh Yes, I am.",dag,ang
Ses02F_script03_2_M043,You're not.,dag,ang
Ses02F_script03_2_F042,I am.  Let go of me.  You're a cruel fiend and I hate and loathe you.,o,ang
Ses02F_script03_2_M044,Shut up. Shut up.,c,ang
Ses02F_script03_2_M045,I wouldn't-- I wouldn't marry--,s,ang
Ses02F_script03_2_M046,I wouldn't marry you if you came in crawling on your knees,o,ang
Ses02F_script03_2_F043,Thank God I realized what you are-- I'd never marry you again ever in my life. You're a cruel fiend and I hate you. You're a beast. You're a beast--I hate you. Stop it.  Stop it.,o,ang
Ses02F_script03_2_M047,You're a evil vampire and I hope to God I never see you again as long as I live.,o,ang
Ses02M_impro01_M000,All right. Finally. Here you go.,s,fru
Ses02M_impro01_F000,"Hi, How can I help you?",g,neu
Ses02M_impro01_M001,"Yea. I just want to get this done,",s,neu
Ses02M_impro01_F001,"Sure, um",a,neu
Ses02M_impro01_M002,get my new license.,s,neu
Ses02M_impro01_F002,do you have two forms of ID with you?,q,neu
Ses02M_impro01_M003,"Um, no, I got my driver's license though.",ans,neu
Ses02M_impro01_F003,"I actually need two forms of ID. I need either a passport or a birth certificate, or social security card. I'm sorry.",s,neu
Ses02M_impro01_M004,"Uh, sorry, I forgot them. I mean I've got to -",ap,neu
Ses02M_impro01_F004,Well,b,neu
Ses02M_impro01_M005,well is the dri-driver's license going to work?,q,neu
Ses02M_impro01_F005,I- I can take your driver's license but I need another form of ID in order to process this paper work.,s,neu
Ses02M_impro01_M006,"Okay, so what are you saying? What-",q,fru
Ses02M_impro01_F006,"Um, that you would need to go home and get another form of ID and come back.",ans,neu
Ses02M_impro01_M007,"What? I- You telling me I waited in that huge line to go and sit down and get my number called, like after",s,ang
Ses02M_impro01_F007,"Well, I'm sorry sir but",ap,fru
Ses02M_impro01_M008,three hours and,s,ang
Ses02M_impro01_F008,you need to bring two forms of ID there is nothing we can do about it.,s,fru
Ses02M_impro01_M009,Shouldn't they have like told us about that? I mean why - why would they make me go and wait three hours if I have got to go and do it again?,q,ang
Ses02M_impro01_F009,"Well, it's actually-",s,fru
Ses02M_impro01_F010,"It's standard that you bring a couple of forms of ID, I'm sorry.",s,fru
Ses02M_impro01_M010,"It's standard? I mean I don't work at the D.M.V. how am I supposed to know that, like, I stand in line, I get my",q,ang
Ses02M_impro01_F011,"Well, I'm sorry, sir, but we're not responsible.",ap,fru
Ses02M_impro01_M011,"I filled out the application right, didn't I?",q,ang
Ses02M_impro01_F012,"Yes, you did, thank you very much, but we're not responsible if you've forgotten something, and we need to have two forms of ID.",ans,fru
Ses02M_impro01_M012,Okay. What about - no -- how about you hold that and I'll - I'll go and I can come back-,q,fru
Ses02M_impro01_F013,"I'm sorry, but there is a lot of people waiting so you're just going to have to get in line again.",ap,fru
Ses02M_impro01_M013,I've been waiting for three hours.,s,fru
Ses02M_impro01_F014,"It just happens to people all the time, I'm sorry sir, but I can't make an exception for you.",s,fru
Ses02M_impro01_M014,This is ridiculous. Come on,o,fru
Ses02M_impro01_F015,"I'm sorry, sir.",ap,neu
Ses02M_impro01_M015,"I cannot go back in that line. I've got stuff I need to do, I mean-",s,fru
Ses02M_impro01_F016,there is nothing I can do.,s,neu
Ses02M_impro01_M016,"But my driver's license - I had to have my birth certificate to get my driver's license in the first place right, I mean this - here is my driver's license so",s,xxx
Ses02M_impro01_F017,"I know sir, but we have to have two forms. There is nothing I can do about it, I'm sorry.",s,fru
Ses02M_impro01_M017,That doesn't make any sense. Why?,q,fru
Ses02M_impro01_F018,"I'm sorry, sir. There is nothing I can do.",ap,fru
Ses02M_impro01_M018,You- shouldn't you have like a sign or something maybe like up on the counter when you get the applica- maybe on the application,s,ang
Ses02M_impro01_F019,"Well, if you had checked the web site it would have said.",s,fru
Ses02M_impro01_F020,If you had checked the website it would have said that you needed two forms of identification.,s,fru
Ses02M_impro01_M019,"What web- I didn't go to a website - why would I need to - it's the D.M.V.. You come to the D.M.V., you wait in line for three hours, and then you go home.",s,ang
Ses02M_impro01_F021,"Well, maybe you should",o,fru
Ses02M_impro01_M020,I waited in line now I'm ready to get my stuff and then go home.,s,fru
Ses02M_impro01_F022,Right. So maybe you should go home now and get your paperwork and come back.,s,fru
Ses02M_impro01_F023,"I'm sorry sir but there's a lot of people waiting. So if you won't move out of the way, then I'm going to have to call security.",ap,fru
Ses02M_impro01_M021,"God, oh my-",b,fru
Ses02M_impro01_M022,This is ridiculous.,o,fru
Ses02M_impro01_F024,"I'm sorry, sir, it's not my choice.",ap,fru
Ses02M_impro02_F001,"I'm going to miss you too; I don't know what I'm going to do here without you. It's going to be so lonely, and so hard.",o,sad
Ses02M_impro02_F002,I don't want to be a single mom.,o,sad
Ses02M_impro02_M001,"You won't be. I'll be back; I'll be back before you know it. All right, and",dag,sad
Ses02M_impro02_F003,but,b,sad
Ses02M_impro02_M002,and,b,sad
Ses02M_impro02_F004,It's dangerous; I mean how can you make sure that you'll,o,sad
Ses02M_impro02_M003,"It's- It's dangerous anywhere, honey. I mean this is -this- I'm just going to go and we'll get it over with,",s,fru
Ses02M_impro02_M004,"I'll come back we'll have, you know, some good benefits from being in the service and then we'll live - we'll live a happy life, then the rest of us, like the three of us.",s,xxx
Ses02M_impro02_F005,I hope so.,o,sad
Ses02M_impro02_M005,A little family.,s,xxx
Ses02M_impro02_F006,I hope so.,o,sad
Ses02M_impro02_M006,You gotta,c,xxx
Ses02M_impro02_F007,It's going to be really rough.,o,sad
Ses02M_impro02_M007,"You gotta take care of our baby for me, alright?",s,sad
Ses02M_impro02_F008,I'll send you lots of pictures.,s,sad
Ses02M_impro02_M008,"I hope so, because I'm not going to be able to survive without all that. I don't know what I'm going to do.",o,sad
Ses02M_impro02_M009,I've never been - I've never been away from you for two weeks let alone a year.,s,sad
Ses02M_impro02_F009,"Well, just promise me that you going to be safe.",s,sad
Ses02M_impro02_F010,"I mean can't they put you in like, you know kitchen work or something where you won't get",q,sad
Ses02M_impro02_M010,"No, it doesn't work that way",ans,xxx
Ses02M_impro02_M011,"but, I mean, I'm going to do whatever I can and get back here as fast as I can.",o,xxx
Ses02M_impro02_F011,It doesn't make any sense; I don't know why we have to be at war in the first place.,o,fru
Ses02M_impro02_M012,"I know, but it's not our decision, I guess, you know, I mean",o,xxx
Ses02M_impro02_M013,there's people that thought it was the right thing to do so now we have to- we have to do what we have to do for our country,s,sad
Ses02M_impro02_M014,"and it'll work out you know, go there and do that. Yeah, I'll be back",s,neu
Ses02M_impro02_F012,"Will you write me letters, paper ones?",q,sad
Ses02M_impro02_M015,"Yeah, of course. I don't know if we'll have computers or anything like that you know, so probably my only option then.",ans,xxx
Ses02M_impro02_M016,"Yeah, I'll write you every day 'cause you're the only thing that's going to be on my mind.",o,xxx
Ses02M_impro02_F013,"Our baby needs a dad; you can't leave. Okay, you can't disappear.",o,sad
Ses02M_impro02_M017,"Our baby has a dad, alright. Daddy is going to be back soon.",ag,sad
Ses02M_impro02_M018,"I want you to, you know, take lots of video; pictures and I can see you when I get back or while I'm there. I'm going to miss you.",s,sad
Ses02M_impro02_F014,I'll miss you too.,o,sad
Ses02M_impro03_M000,"Oh, you're never going to believe it.",o,exc
Ses02M_impro03_F000,What? What? You look really happy what's going on?,q,exc
Ses02M_impro03_M001,"Well, I finally did it",ans,exc
Ses02M_impro03_F001,Finally did what?,q,exc
Ses02M_impro03_M002,I-I asked her to marry me.,ans,xxx
Ses02M_impro03_F002,"You did? Oh, my Gosh, I'm so proud of you.",o,xxx
Ses02M_impro03_M003,"Yes, I know. [LAUGHTER]",ag,xxx
Ses02M_impro03_F003,"Oh, my Gosh. Well, and did",b,exc
Ses02M_impro03_M004,"I'm so nervous you know, I'm-",s,xxx
Ses02M_impro03_F004,Did she say yes?,q,exc
Ses02M_impro03_M005,"Yes, she said yes. [LAUGHTER] I know",ans,exc
Ses02M_impro03_F005,That's like the most definitive.,o,exc
Ses02M_impro03_F006,"Oh, my gosh, wait so when did you decide to do this, I mean,",q,xxx
Ses02M_impro03_F007,I would have thought you would have told me that you were planning on doing this.,o,exc
Ses02M_impro03_F008,"Yea, I guess so. Oh, my Gosh. Was she surprised?",q,exc
Ses02M_impro03_M008,"Yes, yes. You know, she - she was like - I mean, she was happy, you know",ans,exc
Ses02M_impro03_F009,Yeah.,ag,xxx
Ses02M_impro03_M009,"I - I think it was about time, I don't know, maybe. You know what, it's been it's been long enough now.",o,exc
Ses02M_impro03_F010,So what did you do?,q,xxx
Ses02M_impro03_M010,"Oh, well, it was -- you know, we were at this- at this concert and yeah",ans,hap
Ses02M_impro03_M011,so I-I talked to some of the crew before hand and-,s,hap
Ses02M_impro03_F011,"Oh, You did not.",a,exc
Ses02M_impro03_M012,I-I did.,s,hap
Ses02M_impro03_F012,"Oh, my Gosh. that's so cute",o,exc
Ses02M_impro03_M013,"So I got the band to do something, you know, like towards the end of the song I got to go up on stage and, uh",s,xxx
Ses02M_impro03_F013,"That's so romantic. Oh, my Gosh. She must have died. That's like one of those things you write into a magazine about like my boyfriend did this. Oh my God.",o,exc
Ses02M_impro03_M014,"I know, so",ag,hap
Ses02M_impro03_M015,I got to freak her out.,s,hap
Ses02M_impro03_M016,"No, yes -- so",b,exc
Ses02M_impro03_F014,She must have flipped out.,q,exc
Ses02M_impro03_M017,"Yea, that way she was guaranteed that she could not say no.",ans,hap
Ses02M_impro03_F015,Right exactly because you can't say no in front of thousands of people. [LAUGHTER],ag,exc
Ses02M_impro03_M018,"No, but it was good.",o,exc
Ses02M_impro03_F016,Did you bring her up on stage too?,q,exc
Ses02M_impro03_M019,"Yes, yes. [LAUGHTER]",ans,exc
Ses02M_impro03_F017,"Oh, my Gosh, that's so cute.",o,exc
Ses02M_impro03_M020,"I know it was, I don't know I was really nervous but I'm really - I'm really glad.",o,exc
Ses02M_impro03_F018,Are your parents excited or...?,q,exc
Ses02M_impro03_M021,"Oh yes, they - they you know they love her and so I mean...",ans,hap
Ses02M_impro03_F019,"Yea, totally. So when is it going to happen?",q,xxx
Ses02M_impro03_M022,"Well, we're thinking uh - we're thinking winter time, you know, we're going to do it in the winter and then maybe, you know, maybe",ans,xxx
Ses02M_impro03_M023,"I don't know either do a honeymoon like in the snow or fly down to like Australia, Southern Hemisphere, [GARBAGE] so we'll decide with that.",o,xxx
Ses02M_impro03_F020,"Ooh, that would be fun.",o,exc
Ses02M_impro03_F021,"Do you think you'll get a house or something, like you guys are looking to buy some place or",q,xxx
Ses02M_impro03_M024,"Yea, yea, I'm not too sure where yet I guess you know, I kind of got to figure some stuff out here first",ans,exc
Ses02M_impro03_F022,Yeah. [LAUGHTER],ag,xxx
Ses02M_impro03_M025,but like you know it's just - I guess we're just excited right now that we'll get to continue it together.,o,xxx
Ses02M_impro03_F023,"Oh my Gosh. I cannot believe you're getting married, that is so cool.",o,exc
Ses02M_impro03_M026,I know.,ag,exc
Ses02M_impro03_F024,"Golly, it just makes me all like romantic inside, like I really want that to happen to me. [LAUGHTER]",o,exc
Ses02M_impro03_M027,"Oh, it will, obviously you know. But I know it's something - I don't know, you never really think about it happening, like before hand.",ag,hap
Ses02M_impro03_F025,Did you have a good ring? You better have had a good ring.,q,xxx
Ses02M_impro03_M028,"Sure. Oh, yes.",ans,hap
Ses02M_impro03_F026,Good. The ring makes all the difference.,o,xxx
Ses02M_impro03_M029,You know I had my mom come along maybe help me out a little bit because she's got good taste. but,o,xxx
Ses02M_impro03_F027,"Oh, that's awesome.",o,xxx
Ses02M_impro03_M030,"Yes, well, Thanks, thanks. Thank you. yeah",g,exc
Ses02M_impro03_F028,"Yay, well congratulations, that's so cool. [BREATHING] I can't wait.",a,exc
Ses02M_impro03_M031,Hah.,oth,hap
Ses02M_impro04_M001,I don't know what I'm going to do about this; I mean,ans,fru
Ses02M_impro04_M002,"I have got to get a job, you know? Like-",s,fru
Ses02M_impro04_F001,"You've been doing a lot of work for it, right?",q,neu
Ses02M_impro04_M003,"Well, yea you know, I get my resumes and I mean I-",ans,fru
Ses02M_impro04_F002,"Right, so the fact you doing the best that you can is -",o,neu
Ses02M_impro04_M004,"I go out all the places I can, every place that'll give an interview you know.",s,fru
Ses02M_impro04_F003,"you know you shouldn't give yourself a hard time for that, it's the best you can.",o,neu
Ses02M_impro04_M005,"But it's been so long, like what - what am I - what am I waiting -- I should probably just do something else, or",o,fru
Ses02M_impro04_F004,"Well, but you care about what you do, right?",q,neu
Ses02M_impro04_M006,"I don't know, I mean why - why",q,fru
Ses02M_impro04_M007,"Yea, but it's - it's almost like it's not worth it you know, if I'm going to waste to have my life like trying to get a job, I mean once I actually do get the job it's like oh, retirement or something. I don't know, you know.",ans,fru
Ses02M_impro04_F005,"I understand that it's so frustrating but I know that you're here because you really want it you know and, and uh",o,neu
Ses02M_impro04_M008,"Well, and that's what I begin to question after a while is maybe I just don't want it, maybe it's not even worth it, you know, like",o,xxx
Ses02M_impro04_M009,"I don't even know if it's going to be worth it because I can't break myself in, you know like I can't - can't even get a foot in the door you know.",o,fru
Ses02M_impro04_F006,"Well, I mean you're still here you've tried for this long so I think that says something all in itself.",o,neu
Ses02M_impro04_M010,"Yea, it says I'm stupid enough to be trying this long and not move on somewhere else.",o,fru
Ses02M_impro04_F007,You are persistence. I mean that's important. that's,o,neu
Ses02M_impro04_M011,"I mean, I can't- I can't be persistent forever, you know, you can't not have a job forever, you know, I've got- I've got to do something, I've got to make money and get food on the table.",dag,fru
Ses02M_impro04_F008,"Well, you're talented so keep that in mind, you know, you shouldn't give yourself too hard of a time.",o,neu
Ses02M_impro04_M012,"I mean, maybe I'm not, you know. I don't have a job. Maybe - maybe I'm not as good as-as I thought I was and",o,fru
Ses02M_impro04_M013,I just got a whole skewed opinion on just how this is supposed to work out and,s,fru
Ses02M_impro04_F009,I'm sorry.,ap,sad
Ses02M_impro04_M014,"I don't know, it's just not, I don't know - I don't know what to do really, you know, I'm just thinking",s,sad
Ses02M_impro04_M015,"maybe - maybe take up painting, I don't know, you know.",o,fru
Ses02M_impro04_M016,"Do something that I don't have to go out and do something, stay at home, I don't know.",o,fru
Ses02M_impro04_M017,Seems like the only option at this point because obviously the outer world has just rejected me of all possible employment.,o,fru
Ses02M_impro04_F010,"That's- I mean. There are more factors then just whether you're good or not, you know what I mean like",o,neu
Ses02M_impro04_F011,"and the fact that you know there is always different types of things and what kind of people they want in the office and whether it's male or female or you know what I mean, like things are out of your control.",o,neu
Ses02M_impro04_F012,So you should take that in consideration rather than giving yourself such a hard time.,o,neu
Ses02M_impro04_M018,"I know, but I mean- if that's the - you know, I'm either like the worst at this or just the most unlucky person on the planet I mean this doesn't",o,fru
Ses02M_impro04_F013,"It might be the latter I don't know because you're not the worst, I mean you're great, you very talented at what you do.",o,xxx
Ses02M_impro04_M019,this doesn't happen to a normal person.,o,ang
Ses02M_impro04_F014,"You know and the fact you still here and still cooking, like it's good that you're thinking about it, that you're reconsidering.",o,neu
Ses02M_impro04_F015,"But like, just because you're considering why it's been so difficult doesn't mean you should just stop.",o,neu
Ses02M_impro04_M020,"I mean, I don't know, I don't see - I don't see any other way - any other way around it right now.",s,fru
Ses02M_impro04_F016,"Maybe you should take a little break from it, but I don't think you should stop.",o,neu
Ses02M_impro04_M021,What am I going to do on a break?,q,xxx
Ses02M_impro04_F017,"Get out of town or something, I mean you need - you need to clear your head 'cause you seem like you're really frustrated about it. I mean you need to like, be excited about you're doing, rather than, you know upset.",ans,xxx
Ses02M_impro04_M022,Right. Thanks for talking to me.,a,sad
Ses02M_impro05_M001,It seems that uh- my-my bag didn't make it out on the carousel.,s,neu
Ses02M_impro05_F001,"Oh, did you check? Did you make sure as it went around the second time that it-",q,neu
Ses02M_impro05_F003,"Actually I'm looking here at the information, the flight that you were on we had some trouble with some of the baggage, it looks like a few peoples' bags didn't make it through. Um, so-",s,neu
Ses02M_impro05_M003,Okay. So what-what do I have to get you know,q,neu
Ses02M_impro05_F004,"Well, you can fill out this paperwork um- and if for some reason it shows up, we can bring it to you, but-",ans,neu
Ses02M_impro05_M004,"For some reason, so you think it won't show up?",q,sur
Ses02M_impro05_F005,"Well, sometimes it's just late baggage or misplaced baggage and it comes out but it seems to be here and just I'm reading off of this that",ans,neu
