TURN,UTTERANCE,DA,EMOTION
Ses02F_script01_3_M005,"The trouble is, I planned on sort of sneaking up on you over a period of a week or so.  But, they take it for granted that we're all set.",s,xxx
Ses02F_script01_3_F007,"I knew they would, your mother anyway.",ag,xxx
Ses02F_script01_3_F008,"Well,",b,xxx
Ses02F_script01_3_F009,"from her point of view, why else would I come?",q,sad
Ses02F_script01_3_M006,"Oh.  Would you want to?  I guess you know, this is why I asked you to come.",ans,xxx
Ses02F_script01_3_F010,I--I guess this is why I came.,o,xxx
Ses02F_script01_3_M007,"Anne, I love you.  I love you a great deal.  I love you.",o,xxx
Ses02F_script01_3_M008,I have no imagination.  That's all I know to tell you.,s,xxx
Ses02F_script01_3_M009,I'm embarrassing you and I didn't want to tell it to you here.  I wanted some place we'd never been before.  A place where we'd be brand new to each other.,s,xxx
Ses02F_script01_3_M010,"You feel it's wrong here, don't you?  This yard, this chair.  I want you to be ready for me.  I don't want to have to win you away from anything.",o,exc
Ses02F_script01_3_F011,"Oh, Chris, I've been ready for a long, long time.",s,xxx
Ses02F_script01_3_M011,And he's gone forever.  You're sure?,q,xxx
Ses02F_script01_3_F012,I almost got married two years ago.,ans,hap
Ses02F_script01_3_M012,Why didn't you?,q,xxx
Ses02F_script01_3_F013,You started to write me and--,ans,hap
Ses02F_script01_3_M013,You felt something that far back?,q,xxx
Ses02F_script01_3_F014,Every day since.,ans,hap
Ses02F_script01_3_M014,"Anne, why didn't you let me know?",q,xxx
Ses02F_script01_3_F015,"Well, I was waiting for you.  I mean, till then you never wrote and when you did, I mean, what did you say?  You can sure be ambiguous sometimes.",ans,xxx
Ses02F_script01_3_M015,"Give me a kiss, Anne.  Give me a-",c,xxx
Ses02F_script01_3_M016,"oh God, I kissed you.  I kissed Annie.  How long--how long I've been waiting to kiss you.",o,xxx
Ses02F_script01_3_F016,I will never forgive you.  Why did you wait all these years?  All I did was sit and wonder if I was crazy for thinking of you.,o,hap
Ses02F_script01_3_M017,"Oh, Annie, we're gonna live now.  I'm gonna make you so happy.",o,xxx
Ses02F_script01_3_F017,Not like that you're not.,o,xxx
Ses02F_script01_3_M018,I kissed you.,s,xxx
Ses02F_script01_3_F018,"Like Larry's brother.  Do it like you, Chris.  What is it?",q,xxx
Ses02F_script01_3_M019,Let's drive someplace.  I want to be alone with you.,s,xxx
Ses02F_script01_3_F019,"No.  What is it, your mother?",q,xxx
Ses02F_script01_3_M020,No.  Nothing like that.,ans,sad
Ses02F_script01_3_F020,"Then, what's wrong?  I mean, even in your letters there was some--something ashamed.",q,sad
Ses02F_script01_3_M021,"Yeah, I suppose I have been.  But it's going from me.",ans,sad
Ses02F_script01_3_F021,You've gotta tell me.,c,sad
Ses02F_script01_3_M022,I don't know how to start.,s,sad
Ses02F_script01_3_F022,It wouldn't work this way.,s,sad
Ses02F_script01_3_M023,"It's all mixed up with so many other things.  You remember overseas, I was in command of a company?",q,sad
Ses02F_script01_3_F023,"Yeah, sure.",ans,sad
Ses02F_script01_3_M024,"Well, I lost them.",s,sad
Ses02F_script01_3_F024,How many?,q,sad
Ses02F_script01_3_M025,Just about all.,ans,sad
Ses02F_script01_3_F025,"Oh, gee.",b,sad
Ses02F_script01_3_M026,It takes some time for a guy to toss that off.  'Cause they weren't just men.,o,sad
Ses02F_script01_3_M027,"For instance, one time, it had been raining several days and this kid came to me and gave me his last pair of dry socks.  I put them in pocket.  It's only a little thing, but that's the kind of guys I had.",s,sad
Ses02F_script01_3_M028,"They didn't die, they killed themselves for each other.  I mean that exactly.  A little more selfish and they'd have been here today.",o,sad
Ses02F_script01_3_M029,"I got this idea watching them go down.  Everything was being destroyed, see, but it seemed that there was one new thing being made.  A sort of responsibility.  Man for man.",o,sad
Ses02F_script01_3_M030,"You know what I mean?  To show that, to bring that onto the Earth again, like some kind of monument and everyone would feel it standing behind him and it would make a difference to him.",o,sad
Ses02F_script01_3_M031,Then I came back and it was incredible.  There was no meaning in it here.  The whole thing to them seemed like sort of a bus accident.  I went to work with Dad and that rat race again.,s,sad
Ses02F_script01_3_M032,"And I felt what you said, ashamed somehow 'cause nobody was changed at all.  It seemed to make suckers out of a lot of guys.  I felt wrong to be alive to open the new bank book, drive the new car, see the new refrigerator.",s,sad
Ses02F_script01_3_M033,"I mean, you can take those things out of a war, but when you drive that car, you've gotta know that it came out of the love a man can have for a man.  You've gotta be a little better because of it.",o,sad
Ses02F_script01_3_M034,Because otherwise all you have is really loot and there's blood on it.  And I didn't want to take any of it.  And I guess that included you.,o,sad
Ses02F_script01_3_F026,You still feel that way?,q,sad
Ses02F_script01_3_M035,I want you now Annie.,ans,xxx
Ses02F_script01_3_F027,"Cause you mustn't feel that way.  Because you have a right to everything that you have.  Do you understand that?  Everything, Chris, and me too.",o,xxx
Ses02F_script01_3_F028,"I mean, and your money, there's nothing wrong with your money.  I mean, your father put hundreds of planes in the air.  A man should be paid for that.",o,xxx
Ses02F_script01_3_M036,"I know Annie.  Annie, I'm gonna make a fortune for you.",ag,xxx
Ses02F_script01_3_F029,What'll I do with a fortune?,q,hap
Ses02F_script02_1_M000,What time is it?  They're supposed to run around midnight.,q,exc
Ses02F_script02_1_M001,"This is great, isn't it?  Look at the night we've got here, couldn't be better.",o,exc
Ses02F_script02_1_M002,"I would have liked to have gone a little further up the coast to get away from the lights and the people, but I was afraid we'd miss it.",o,exc
Ses02F_script02_1_M003,How you doing?,q,exc
Ses02F_script02_1_F000,Fine.,ans,xxx
Ses02F_script02_1_M004,Is that--no--is that just foam?  I can't even tell.,s,exc
Ses02F_script02_1_M005,"Well, I guess we can tell, it probably isn't right?  Probably be unmistakable don't you think?",q,exc
Ses02F_script02_1_M006,"How you doing?  Aw, you know what I forgot?  I forgot to bring my flashlight.  Oh, how could I be so stupid?  I should've brought my flashlight.",s,exc
Ses02F_script02_1_F001,What flashlight?,q,neu
Ses02F_script02_1_M007,"You know, the flashlight, the silver one.  There's only one isn't there?",ans,xxx
Ses02F_script02_1_F002,That's not your flashlight.,s,xxx
Ses02F_script02_1_M008,Who's is it?,q,xxx
Ses02F_script02_1_F003,It's ours.  It's mine too.,ans,xxx
Ses02F_script02_1_M009,"Oh, well sure.",ag,neu
Ses02F_script02_1_F004,"You kept saying my flashlight, if as if somehow it's just yours.  I mean is that supposed to make me feel?",q,xxx
Ses02F_script02_1_M010,"Right, of course.  Our flashlight.  Mine and yours.  I mean, me flashlight is su flashlight naturally.",ag,neu
Ses02F_script02_1_M011,How could we forget to bring it?  I hope the moon stays out.,o,xxx
Ses02F_script02_1_M012,"I wonder, do they always run during a full moon?  I can't remember if it was full last year.  Do you remember?",q,neu
Ses02F_script02_1_F005,Yeah.,ans,neu
Ses02F_script02_1_M013,"You cold?  Do you want my jacket?  Oh, we should've brought the blanket.  Our blanket.",s,neu
Ses02F_script02_1_M014,"This is great, isn't it?  A six pack would be just the ticket right now.",s,exc
Ses02F_script02_1_M015,I can't believe I forgot.  I'm like a kid.  It's amazing I got out of the house with my fly zipped.,o,exc
Ses02F_script02_1_M016,You think they can hear us talk?  Or feel the vibrations in the sand when we move around?,q,exc
Ses02F_script02_1_F006,I'm cold.,s,xxx
Ses02F_script02_1_M017,Do you want my jacket?,q,neu
Ses02F_script02_1_F007,"It's after eleven, let's just go home.",s,fru
Ses02F_script02_1_M018,Are you kidding?  We'd miss it.  We just got here.  What's the point of coming down here if we just turn around and go home.,q,xxx
Ses02F_script02_1_F008,There is no point in coming down here.,ans,xxx
Ses02F_script02_1_M019,Right.,b,neu
Ses02F_script02_1_F009,That's my point.,s,xxx
Ses02F_script02_1_M020,That's my point too.,ag,neu
Ses02F_script02_1_F010,"So, let's go.",c,xxx
Ses02F_script02_1_M021,No. No. That's not my point.  The point is there's no point in coming down if we just leave.  Don't you want to see it?,dag,neu
Ses02F_script02_1_F011,Not particularly.,ans,xxx
Ses02F_script02_1_M022,Why not?,q,xxx
Ses02F_script02_1_F012,I just don't.  It's stupid.,ans,xxx
Ses02F_script02_1_M023,"Honey, this is a natural phenomenon.  I mean this only happens once a year, you know.",s,xxx
Ses02F_script02_1_M024,"Think about the people in Kansas, they had to get plane tickets and hotel reservations to see this.  We live forty minutes away.  It's too good to pass up.",s,exc
Ses02F_script02_1_F013,"Pass up what?  These little fish swim onto the beach, they flop around, and swim away.  And then they die.",s,fru
Ses02F_script02_1_M025,"Yeah, but that moment on the beach, is the highlight of their little lives.  All that flopping is laying eggs or what do you--spawning or mating.  I mean,",s,exc
Ses02F_script02_1_M026,this is a big night for these guys.  Life's last orgy.,o,exc
Ses02F_script02_1_F014,"What are you so excited about?  I mean, it's not a moon landing we're talking about here.  It's fish.  It's a fish nobody even eats.",o,fru
Ses02F_script02_1_M027,Yeah they do.,dag,fru
Ses02F_script02_1_F015,"Ah, Augie.",b,fru
Ses02F_script02_1_M028,Alright.  But it's fish that do something that none of the other fish do.  Like the swallows returning to Capistrano or the lemmings throwing themselves off the cliffs.,s,exc
Ses02F_script02_1_M029,There's--there's a bit of the magic--some unexplainable here.  I don't see how you can not be interested.,o,xxx
Ses02F_script02_1_F016,I'm just not.,s,fru
Ses02F_script02_1_M030,For real?,q,xxx
Ses02F_script02_1_F017,Yeah.,ans,xxx
Ses02F_script02_1_M031,"I don't get it.  The first time we came here, you said it was the best night of your life.",s,neu
Ses02F_script02_1_M032,"And last year, I remember specifically you were so excited to go that you stubbed your toe rushing me out of the house and didn't even notice until we got in the car.",s,xxx
Ses02F_script02_1_F018,"Last year, you will also remember our shoes got wet, I got sand in my panties, you got a sore throat, we got in a big fight over nothing, and we didn't see the grunions.",s,fru
Ses02F_script02_1_M033,We weren't in a good spot.,o,neu
Ses02F_script02_1_F019,We didn't see them the first time either.,s,neu
Ses02F_script02_1_M034,"We just weren't in a good spot.  This is a much better spot.  Believe me, I've got good instincts for these things.",o,xxx
Ses02F_script02_1_M035,There is that--no that's just seaweed isn't it?,q,exc
Ses02F_script02_1_M036,"Oh man, this is great, isn't it?  I wouldn't miss this for anything.  Here, think about this, all right, I know you're not interested, but think about this.",c,exc
Ses02F_script02_1_M037,"Somewhere out there, this huge mass of silver fish swimming this way.",s,xxx
Ses02F_script02_1_M038,"They don't know why, we don't know why.  Nobody sent them an invitation or a map, it wasn't a decision, just-",s,xxx
Ses02F_script02_1_M039,"all as one, this time release instinctual little firecracker went off and they all turned and formed a line as long as the California coast and started swimming.  And they're swimming right now as if that's all that matters.",s,exc
Ses02F_script02_1_M040,It's like single mindedness with no mind.  It's urgency that's pure urge.  They don't know what drives them.  They don't ask it a question or give it a name.,o,exc
Ses02F_script02_1_M041,"They just turn as one and start the swim that brings them right here to where we stand, for a massive celebration of sex and death.",s,exc
Ses02F_script02_1_M042,"Ah, God, I'm giving myself goose bumps.  Look, all my hairs are popped up.",s,exc
Ses02F_script02_1_F020,That's the wind.,s,xxx
Ses02F_script02_1_M043,"Well, so what do you think?",q,neu
Ses02F_script02_1_F021,About what?,q,neu
Ses02F_script02_1_M044,What I was saying.,ans,neu
Ses02F_script02_1_F022,It's ridiculous.,o,xxx
Ses02F_script02_2_M000,"Well, so what do you think?",q,exc
Ses02F_script02_2_F000,About what?,q,neu
Ses02F_script02_2_M001,What I was saying.,ans,neu
Ses02F_script02_2_F001,It's ridiculous.,o,fru
Ses02F_script02_2_M002,It certainly is not.  It's slightly exaggerated scientific fact.,dag,neu
Ses02F_script02_2_F002,It's PR.  Somebody sold you a bill of goods that this wonderful event is gonna take place on the beach.,o,xxx
Ses02F_script02_2_M003,"Well, I'm not the only one.  Look at all these people.",dag,neu
Ses02F_script02_2_F003,"Sure, everybody's told the same story.  It keeps us all excited.  It keeps us coming back for more.  It keeps us thinking that life is gonna start any second now if we could just find the right spot and get in on the action.",o,xxx
Ses02F_script02_2_M004,Are we talking about the same thing?,q,xxx
Ses02F_script02_2_F004,"Well, I'm sorry, but it's still just fish to me.",ans,xxx
Ses02F_script02_2_M005,"Carla, can I ask you something?  Don't take this wrong, but are you having your period?",q,neu
Ses02F_script02_2_F005,"God damn it, Augie, don't ask me that.  I hate it when you ask me that.  You always ask me that.  It's insulting.",ans,ang
Ses02F_script02_2_M006,"Well, what's bugging you?",q,fru
Ses02F_script02_2_F006,We just have different ideas of what this evening is supposed to look like.,ans,ang
Ses02F_script02_2_M007,"There's nothing to it.  We come here, the grunion arrive, they do their little fish business, we go ooh, ah, look at the fish.  They go home. We go home.",s,neu
Ses02F_script02_2_F007,"For heaven sake, we're not going to see the grunions.",o,fru
Ses02F_script02_2_M008,Why not?,q,fru
Ses02F_script02_2_F008,"We never do, do we?  I mean, have we ever?",q,fru
Ses02F_script02_2_M009,We've missed them twice.  That's not ever.,ans,neu
Ses02F_script02_2_F009,Twice is every time we've tried. That's ever.,s,fru
Ses02F_script02_2_M010,"Well, we'll see them this year.",o,neu
Ses02F_script02_2_F010,"No, we won't.  It's pointless.  It's like waiting up to see Santa Claus.",dag,fru
Ses02F_script02_2_F011,"I mean, I feel like my whole life is gonna be spent standing on the beach with my eyes wide open and my hands clasped expectantly waiting for the fish to show up.  And the fish won't show up.",o,ang
Ses02F_script02_2_M011,I thought you wanted to see it.,o,fru
Ses02F_script02_2_F012,You don't understand anything I'm saying.,s,fru
Ses02F_script02_2_M012,"No, of course not.",dag,fru
Ses02F_script02_2_F013,I did want to see it.  I always do.  I keep thinking that this is gonna be the time and it never is.,o,fru
Ses02F_script02_2_M013,It's just fish.  Nothing to get traumatized about.,o,neu
Ses02F_script02_2_F014,"For heaven sake, this isn't about fish.",s,xxx
Ses02F_script02_2_M014,"All right.  Look, I've been trying to work this backwards, but I cannot seem to figure out the exact moment that we took a turn for the worst.",s,fru
Ses02F_script02_2_M015,"I mean, you were-  you were fine during the phone call from Marge.  Dinner was okay.  Doing the dishes was no problem.  Let's see.  I took a shower.  You watched the news.",s,xxx
Ses02F_script02_2_M016,"You said, ""Hey the grunion are running tonight.""  I said, ""Great, let's go.  I feel lucky.""",s,neu
Ses02F_script02_2_M017,"Okay, so I'm putting on my jacket, putting out the animals, getting the car out of the garage--",s,neu
Ses02F_script02_2_F015,"Do you remember the first time we came to see it?  It was about four years ago, right after we got married.",s,sad
Ses02F_script02_2_F016,"I thought I was pregnant, you had a bottle of champagne, but no glasses.  You asked me to dance, so we kicked off our shoes and you popped the cork.",s,sad
Ses02F_script02_2_F017,"And while we were dancing, you said the softest, most intimate things to me right into my ear so that I could feel them as much as hear them.",s,sad
Ses02F_script02_2_F018,"And I remember thinking, this is it.  You know, at last--at last I am as happy as I am supposed to be.",s,sad
Ses02F_script02_2_M018,Wait a minute.  I've got it.,c,neu
Ses02F_script02_2_F019,"Just dancing barefoot in the sand, drinking champagne out of the bottle.",s,sad
Ses02F_script02_2_M019,"It was in the car, right?  Driving past the Knickerbocker Liquor Locker, you said, ""let's get some champagne,"" and I said, ""time's a wasting"" or something like that, right?",q,neu
Ses02F_script02_2_M020,"Yeah, of course, I see it now.  You want this to be like that other time, right?  That's it, right?",q,neu
Ses02F_script02_2_F020,I'd rather not remember some things.  I would rather not hope for some things.,ans,sad
Ses02F_script02_2_M021,"Okay, yeah, sure, I see it now.  Listen, you wanna dance?",q,neu
Ses02F_script02_2_F021,No.,ans,sad
Ses02F_script02_2_M022,You want me to go get some champagne?,q,neu
Ses02F_script02_2_F022,No.,ans,sad
Ses02F_script02_2_M023,Take off our shoes?,q,neu
Ses02F_script02_2_F023,No. No.,ans,xxx
Ses02F_script02_2_M024,"Well, what?  You want me to breathe in your ear?",q,fru
Ses02F_script02_2_F024,No.,ans,sad
Ses02F_script02_2_M025,You wanna get married again?,q,fru
Ses02F_script02_2_F025,No.,ans,fru
Ses02F_script02_2_M026,What?  What?  You want a divorce?,q,fru
Ses02F_script02_2_F026,No.,ans,fru
Ses02F_script02_2_M027,A vacation?,q,fru
Ses02F_script02_2_F027,No.,ans,fru
Ses02F_script02_2_M028,"A new carpet?  A poodle?  Ice cream?  Back rub?  A suicide pact?  What?  What?  Carla, what the hell do you want?",q,fru
Ses02F_script02_2_F028,I want something to turn out the way that it's supposed to.,ans,xxx
Ses02F_script02_2_M029,"Well, welcome to the human race.  Do you think this is what I had in mind when I proposed?  That four years down the road, we'd be at the beach yelling at each other over fish?",q,ang
Ses02F_script02_2_M030,"No.  You think I knew that there'd be times when you'd look at me like a used Kleenex?  Or that I'd look at you and think, holy hell, when's the next flight to Alaska?",s,xxx
Ses02F_script02_2_M031,"No, Carla, I'm just like you.  I thought it was gonna be all peaches and roses and sand in our toes and wind in our hair and the fish will always come and the bills will pay themselves and we'll have three fat rosy kids and ha, ha, baby, the joke's on us",o,sad
Ses02F_script02_2_M032,"cause you know what you get, Carla?  You know what you get?  This.",s,fru
Ses02F_script02_2_F029,This.  What?  What is this?  This isn't even anything.,s,xxx
Ses02F_script02_2_M033,"Yes, it is.",dag,neu
Ses02F_script02_2_F030,"Uh, right this is standing on the beach.  This is waiting.  This is fighting.",o,xxx
Ses02F_script02_2_M034,Right.,ag,neu
Ses02F_script02_2_F031,Well.  This isn't anything like I thought anything would be like.,o,sad
Ses02F_script02_2_M035,"I know, me neither.",ag,sad
Ses02F_script02_2_F032,"I mean, this is just this.  It includes a lot and everything, but it isn't something else.  Do you have any idea what I'm trying to say?",q,xxx
Ses02F_script02_2_M036,I'm doing the best I can.,ans,sad
Ses02F_script02_2_F033,"I know that, Augie.  Really, I do.",ag,sad
Ses02F_script02_2_F034,"I know that you meant this to be special and nice and the sand and the moon and all, but I just couldn't help thinking about being somewhere else.",o,sad
Ses02F_script02_2_M037,Maybe if you were with somebody else too.,o,sad
Ses02F_script02_2_F035,I didn't say that.,dag,sad
Ses02F_script02_2_M038,"No, I know.  But still.  I know I don't make you happy.",ag,sad
Ses02F_script02_2_F036,"Oh, for heaven sake, whatever I'm doing, I'd rather be doing it with you.",o,xxx
Ses02F_script02_2_M039,Yeah?,q,sur
Ses02F_script02_2_F037,"Oh, don't be ridiculous.  I mean, don't you know that?",q,xxx
Ses02F_script02_2_F038,You're the one who probably wishes you were with someone else.  Someone who--you'd rather enjoy yourself and didn't take everything so hard.,o,sad
Ses02F_script02_2_M040,"Well, now that you mention it.  No, I don't.",dag,xxx
Ses02F_script02_2_F039,"Okay.  Fine so.  We're in the wrong spot, but we're with the right person.",o,xxx
Ses02F_script02_2_M041,"I don't know.  It seemed like a pretty good spot to me.  I mean, look at the view you have of the moon from here.",o,hap
Ses02F_script02_2_F040,"Yeah, I noticed that.  Looks pretty, doesn't it?  Big ol' white moon.",o,xxx
Ses02F_script02_2_M042,"Well, look what we have here.",s,hap
Ses02F_script02_2_F041,"Augie, you brought refreshments.",s,hap
Ses02F_script02_2_M043,It's not champagne.,s,hap
Ses02F_script02_2_F042,"Well, then we don't need glasses.",s,hap
Ses02F_script02_2_M044,You still cold?  Do you wanna go home?,q,xxx
Ses02F_script02_2_F043,No.  I think you might be right.  Maybe this is the spot after all.,ans,hap
Ses02F_script02_2_F044,"Augie, I'm sorry.",ap,sad
Ses02F_script02_2_M045,Shh.  If we're very quiet the fish might come.,o,hap
Ses02F_script02_2_F045,Or not.,o,hap
Ses02F_script02_2_M046,Or not.,ag,hap
Ses02F_script03_1_M000,Good God.,s,xxx
Ses02F_script03_1_F000,Do you think it's them?,q,fea
Ses02F_script03_1_M001,I wonder.,ans,neu
Ses02F_script03_1_F001,"Well, nobody know we're here except Freda and she wouldn't ring up.",s,fea
Ses02F_script03_1_M002,"Must be them, then.",s,xxx
Ses02F_script03_1_F002,What're we gonna do?,q,fea
Ses02F_script03_1_M003,"We're all right, darling, aren't we?  Whatever happens.",s,xxx
Ses02F_script03_1_F003,"Now and always, sweet.",ag,xxx
Ses02F_script03_1_M004,I don't care then.,s,neu
Ses02F_script03_1_F004,It was bound to come sooner or later.,s,xxx
Ses02F_script03_1_M005,Hello?  Hello?  What?  Wrong number.,s,neu
Ses02F_script03_1_F005,"Ah, it send shivers up my spine.",s,exc
Ses02F_script03_1_M006,What do we do if they suddenly walk in on us?,q,xxx
Ses02F_script03_1_F006,Behave exquisitely.,ans,hap
Ses02F_script03_1_M007,With the most perfect poise?,q,neu
Ses02F_script03_1_F007,"Oh, of course.  I shall probably do a court curtsy.",ans,hap
Ses02F_script03_1_M008,Things that ought to matter dreadfully don't matter at all when one's happy.  Do they?,q,neu
Ses02F_script03_1_F008,What's so horrible is that one can't stay happy.,ans,hap
Ses02F_script03_1_M009,"Oh, darling, don't say that.",c,neu
Ses02F_script03_1_F009,It's true.  The whole business is a very poor joke.,o,hap
Ses02F_script03_1_M010,"Meaning that sacred and beautiful thing, love?",q,neu
Ses02F_script03_1_F010,"Yes, meaning just that.",ans,hap
Ses02F_script03_1_M011,"Oh, what does it all mean?  That's what I ask myself in my ceaseless quest for ultimate truth.  Dear God, what does it all mean?",q,xxx
Ses02F_script03_1_F011,Don't laugh at me.  I'm serious.,c,xxx
Ses02F_script03_1_M012,"You mustn't be serious, my dear one.  That's just what they want.",o,neu
Ses02F_script03_1_F012,Who's they?,q,neu
Ses02F_script03_1_M013,All those futile moralists that try to make life unbearable.  Laugh at them.  Be flippant.  Laugh at everything.  All their sacred shibboleths.,ans,neu
Ses02F_script03_1_M014,Flippancy brings out the acid in their damn sweetness and light.,o,neu
Ses02F_script03_1_F013,"If I laugh at everything, then I must laugh at us too.",o,neu
Ses02F_script03_1_M015,"Certainly, you must.  We're figures of fun, alright.",ag,neu
Ses02F_script03_1_F014,"Well how long will it last us, this ludicrous overbearing love of ours.",q,neu
Ses02F_script03_1_M016,Who knows.,ans,neu
Ses02F_script03_1_F015,"Well, shall we always want to bicker and fight?",q,neu
Ses02F_script03_1_M017,"No, that desire will fade.  Along with our passion.",ans,neu
Ses02F_script03_1_F016,"Oh, dear, shall we like that?",q,neu
Ses02F_script03_1_M018,Depends on how well we've played.,ans,neu
Ses02F_script03_1_F017,"Well, what happens if one of us dies?  I mean, does the one that's left still laugh?",q,neu
Ses02F_script03_1_M019,Yes.  Yes. With all his might.,ans,exc
Ses02F_script03_1_F018,"That's serious enough, isn't it?",q,xxx
Ses02F_script03_1_M020,"No. No, it isn't.  Death is very laughable.  Such a cunning little mystery.  All done with mirrors.",ans,exc
Ses02F_script03_1_F019,"Darling, I believe you're talking nonsense.",o,hap
Ses02F_script03_1_M021,So is everyone else in the long run.,o,neu
Ses02F_script03_1_M022,"Let's be superficial and pity the poor philosophers.  Let's blow our trumpets and squeakers and enjoy the party as much as we can.  Like quite idiotic, very small school children.  Let's savor the delight of the moment.",o,exc
Ses02F_script03_1_M023,"Come and kiss me, darling, before your body rots and worms pop in and out of your eye sockets.",o,exc
Ses02F_script03_1_F020,"Elliott, worms don't pop.",s,hap
Ses02F_script03_1_M024,"I don't care what you do.  See, you could paint yourself green and dance naked in the Place Vendome and rush off madly with all the men in the world and I shan't say a word.  As long as you love me best.",o,neu
Ses02F_script03_1_F021,"Oh, thank you, dear.  The same applies to you except that if I catch so much as looking at another woman, I'll kill you.",o,hap
Ses02F_script03_1_M025,You remember that awful scene we had in Venice?,q,neu
Ses02F_script03_1_F022,Which particular one?,q,hap
Ses02F_script03_1_M026,The one when you bought that little painted wooden snake in the Piazza and put it on my bed.,ans,neu
Ses02F_script03_1_F023,Charles.  That was his name.  Charles.  He did wriggle so beautifully.,s,hap
